id,name,description
5VzFvh1JlEhBMS6ZHZ8CNO,anything goes with emma chamberlain,"emma prefers to share her thoughts with a microphone rather than a physical human being, so thank god she has a podcast. recorded from the comfort of her bed...and some other fun places, emma talks at length about whatever is on her mind every week. anything really does go on this podcast. sometimes philosophy, sometimes a random story from 10 years ago, sometimes advice, sometimes fun interviews, and sometimes nothing at all. you never know what you are going to get, but that’s what keeps it interesting. new episodes every thursday and sunday, video available only on spotify."
47Gni7TSEnmG7nOR001BuR,Pingin Siaran,"Setelah Dikejar ormas yang menyebabkan Muslim dan Coki dipecat dari Stasiun Radio tempat mereka siaran, keinginan mereka siaran membuat mereka pingin membuat konten ini untuk tetap meyalurkan suara mereka. Tapi, kali ini dengan banyak bantuan dari orang-orang yang tidak jelas. • Youtube: S1:https://youtube.com/playlist?list=PLuPYeNp5S16F6gBSfF36xcqcrTOszqHuI • S2:https://youtube.com/playlist?list=PLuPYeNp5S16G0IA6Q61lReSVdKhIhZGXL"
5qMLiKXvP7ABWOFPCd3d3U,Dongeng Paman Gery,"Dongeng seru Paman Gery untuk anak-anak segala usia!   Bahkan untuk kamu juga! Ya, kamu yang membaca ini!"
7f0PMFZywCyyg4X869oTAM,Kakak Beradik Podcast,"Obrolan kakak beradik seputar kehidupan, kehantuan dan kecintaan"
3aN3zOLlMCS0K8ajqj5yd4,Odyssey Podcast Filsafat,"Membahas dan mendiskusikan tema filsafat. Host: M. Rodinal Khair Khasri/ Odi (@rodinalkhair). Update info diskusi mingguan di IG: @odysseyfilsafat @collectiveacademia Tersedia di Spotify, Noice, Apple Podcast, Google Podcast, POGO FM dst. Selamat menikmati!  Support this podcast: https://podcasters.spotify.com/pod/show/odyssey95/support"
0MeZ3WzNjCiybjRaYfDa8S,Podcast Bisnis Muda,Podcast yang akan membahas seputar bisnis dan investasi yang dibawakan secara santai namun tetap isinya 'daging semua'.  Contact us: untukmimin@bisnismuda.id
496rIAtmrFLTSbgD611NCg,PODCAST MISTERI KISAHORROR,Sesuatu yang menimbulkan perasaan ngeri atau takut yang amat sangat. Hal-hal yang terjadi di luar nalar akan kita bahas disini di PODCAST MISTERI KISAHORROR
5qzQSvqt3TGnoFAueEtDNH,Randy & Gustika Are: Unqualified,"Unqualifed adalah sebuah podcast yang direkam ketika Randy dan Gustika cocok jadwalnya.  Untuk berpartisipasi, silakan kirimkan curhat kamu ke hi.unqualified@gmail.com  Untuk berteman di social media:  Instagram: randyhimself & gustikajusuf Twitter: rndy11 & gustika  Part of Box2box Media Network"
6FeEVBHr4EF5ofn2UZRYrF,Kajian Hanan Attaki 1,"Wadah mendengarkan kajian hanan attaki. Kerja, Main, Nongkrong, Apapun yang dilakukan sambil ngaji!"
4tCQsDwyLGvripYGTs4mnF,Podcast Horor Lagi Di Kamar ,"Hallo Para Penghuni Kamar. Selamat datang di LDK, Podcast Horror Lagi di Kamar season 02 | Kamu punya pengalaman horor nyata yang mau dibagikan? Boleh DM Instagram @lagidikamar"
2uaNFrFm3Fb1EpASzXTBAc,Islamic Histories Podcast,Assalamu'alaikum! Welcome to islamic histories podcast! Kita bakal belajar bareng tentang berbagai hal-hal epic dari sejarah islam dan mengaplikasikan dalam kehidupan kita sehari-hari. Past Prevent Future!  instagram: @islamichistories
7gIctutaESuBWqW5Ingx8t,Podcast Horormu,Dengarkan pengalaman mencekam berkaitan dengan dunia tak kasat mata di #PodcastHorormu
2CnfQ8ILpsIOebQFI0dVBo,Podcast Semi Horor,Sebuah podcast yang akan mengulas segala hal yang berkaitan dengan dunia gaib (tak kasat mata).  kami juga membacakan/menyampaikan cerita pengalaman horor kirirman dari kalian.  Kirim cerita kalian ke podcastsemihoror@gmail.com  Follow kami di sosial media  Instagram : @podcastsemihoror ( https://instagram.com/podcastsemihoror )   Twitter : @pod_semihoror
0Vws24odpEoXt0c8afqcSv,Census Nusantara,"Ada lebih dari 17 ribu pulau dan 275 juta orang di Indonesia. Beragam adalah kata kunci untuk merefleksikan warga nusantara ini. Bersama saya, Fathia Izzati dalam CENSUS NUSANTARA. kami hadirkan cerita-cerita hebat yang belum pernah kamu dengar. Setiap hari Kamis hanya di Spotify."
1YDeHMXdz7cfvHm8Bu3YAV,Lintas Makna,"Bicara tentang kehidupan, cinta, karir, teman, keluarga dan sebagainya melalui dua sudut pandang lintas generasi, untuk belajar atau memberikan pelajaran tentang persoalan yang sedang, akan atau sudah dialami dalam proses pendewasaan diri.  Melihat lebih jelas dengan dua sisi melalui lintas generasi, karena proses menjadi dewasa bukan hal yang fana.   Setiap Selasa, jam 18.00 WIB.  Part Of CXO Media."
0SIgUHHz9FD1ZxWSoxkgiI,Teman Berkata,Cerita tentang kita dan serba serbi dunia
3k1f239b4o0ais2Yt5OID2,OUTSIDEIN Podcast,"OUTSIDEIN Podcast is your go-to source for honest conversations on marriage and relationships. We believe that there is no one-size-fits-all solution, and strive to provide an informative and engaging platform for our listeners. Our episodes feature candid conversations between real couples. Whether you’re a newlywed or have been married for years, you can gain a more holistic perspective on the topics that matter. Join the family!"
1WBnH7H2F7cNFJGJL0zLBs,Fans Stand Up Comedy Indonesia,Stand Up Comedy Indonesia
0z2ydI7p9BA6wxFiq8U0lF,De Universiteit van Nederland Podcast,"De beste wetenschappers geven antwoord op spraakmakende vragen. Zo leer je binnen 15 minuten waarom muggen altijd jou moeten hebben en hoe robots ons leven redden. Van donkere materie tot verliefdheid bij dieren: alles komt voorbij!  Deze podcast heeft een Creative Commons-licentie (CC BY). Deel onze podcast dus zo veel als je wil, maar vergeet onze naam zeker niet te vermelden."
6BDhpaUii8ss762W2ZbObf,Erazno y La Chokolata El Podcast,"Si buscas la palabra NACO en el diccionario, encontrarás la foto de Erazno! 😂😈 Escucha a Erazno y la Chokolata a cualquier hora y en cualquier lugar. ▼▼▼▼"
7jIyHfFWNcKXvfhtRn9THA,Ang Walang Kwentang Podcast,"Filmmakers and real-life friends Antoinette Jadaone and JP Habac let you eavesdrop on their hilarious and sometimes *insightful* conversations with their guests as they make tsika about love and hugot, pop culture and trending topics that make their heart a-flutter or a a-angry. Dahil ang pag-ibig, dapat shine-share."
4zxWKrXbpYdfc4E8kSiW9X,Belajar Bahasa Jepang Lewat Cerita ,Belajar bahasa Jepang dari nol lewat cerita seru.
79MfsabSyTsG4ZJMh6nJld,Mahdianto - Minimalist Indonesia,"Minimalist Indonesia adalah podcast tentang gaya hidup minimalis dan inspirasi dari kehidupan yang sederhana dan tertata rapi. juga membahas cara mengatur keuangan, meningkatkan produktivitas bisnis, dan investasi."
0YSOZ0EGDjIlR2bdxhONUy,GAMAL,Kita membicarakan tentang bagaimana proses untuk menjadi High Value Male. Say no to Hopeless #gantengmaksimal  Tersedia juga di youtube GAMAL untuk versi videonya.
7GxeOJgWVqzuSuC1kWOI0L,PODCAST HOROR MASA KINI,PODCAST HOROR MASA KINI By Deni Krisnanto (SULE) adalah podcast kisah horor true story yang coba gue bacakan apa adanya sesuai alur cerita dari sang penulis yang sudah ada di BLOG dan menjadi thread story ataupun kalian yang punya cerita horor real silahkan FOLLOW & DM di Instagram pribadi saya @dheni_virgiawan_krisnanto selamat menikmati SOBAT PODCAST HOROR MASA KINI
34NcOzUEJs0T5DaUeYLfFl,The MeidasTouch Podcast,"Ben, Brett and Jordy Meiselas are three brothers with very unique backgrounds! Ben is a top lawyer and Colin Kaepernick’s business partner. Brett is a two-time Emmy award winning video editor from the world of film and television. Jordy, the fan favorite, was an award-winning advertising executive in New York. The brothers' unique approach at covering news by combining hilarious brother banter with an unapologetic support of democracy has earned them millions of supporters in America and across the globe and made them social media icons. The MeidasTouch Podcast combines brotherly love, comedy, news coverage, and deep discussions about supporting our democracy and is the go-to destination for top political leaders who view the podcast as a pivotal stop for their interviews. Join the Meiselas brothers and their loyal following — the self-described MeidasMighty — with new episodes featuring all three brothers released every Tuesday and Friday morning, and breaking news updates every single day! Catch the MeidasTouch Podcast with the brothers LIVE on video every Monday and Thursday night at 8p ET/5p PT on the MeidasTouch YouTube channel!"
34HxTaXogxr7FHDdkebrM9,Crazy Love Podcast,"Podcast with Francis Chan, best-selling author of Crazy Love, Forgotten God, Erasing Hell, Multiply, You and Me Forever and Letters to the Church, and most recently Until Unity.  For more resources from Crazy Love Ministries or to support the work of Crazy Love please visit our website at crazylove.org"
7G8X3uikqwAmvr92MHFZO6,The Joe Budden Podcast,Tune into Joe Budden and his friends. Follow along the crazy adventures of these very random friends.
2KDDz0K7yg4j1PaaiM0rsI,Teman Tidur,"It's okay to not be okay. Tenang, kamu tidak sendiri di bumi ini. Ada Teman Tidur yang siap menemani tidur mu :-)  ---- Menerima submisi tulisan atau audio cerita mu di : suara.temantidur@gmail.com atau https://www.instagram.com/_alaaak/  ---- Send in a voice message : https://anchor.fm/alaaak/message"
4XxCBLTreWlKpmDelf3qOh,Lakon Wayang Golek ,Menyajikan lakon-lakon wayang golek yang dibawakan oleh dalang-dalang fenomenal dari Tatar Pasundan. credit photo by kompas
3NEhj0p5kEPLYXBE6L47Mr,Semua Bisa Cantik,"Kanal siniar yang dikelola oleh Medio Podcast Network by KG Media, bekerja sama dengan Stylo Indonesia yang mengisahkan para perempuan Indonesia dengan berbagai latar belakang dalam merangkul serta mendefinisikan kecantikannya. Kami percaya bahwa cantik, lebih dari sekadar fisik semata.   Tayang setiap hari Selasa dan Kamis. . MEDIO by KG Media Playlist podcast by Medio di Spotify: https://link.tree/SiniarMedio Instagram: https://instagram.com/mediobykgmedia TikTok: https://tiktok.com/@mediobykgmedia Read about us on: https://kolom.kompas.com/Medio.KGMedia Saran dan kolaborasi: podcast@kgmedia"
4VbXdY5AbBWUH5eNZFk6ok,Balada+62 bareng Kukuh dan Dwik yuk!,Balada+62 persembahan Medio by KG Media dan Trusty Comedy yang membahas isu sosial dengan sudut pandang komedi ala Kukuh Adi dan Dwik.   Episode akan tayang setiap hari Jumat. Dengarkan selengkapnya di Noice!    - MEDIO by KG Media Playlist podcast by Medio di Spotify: https://link.tree/SiniarMedio TipTip : https://tiptip.co/p/balada62 Noice : https://noiceid.onelink.me/cyOg/lqjzgb28 Instagram: https://instagram.com/mediobykgmedia TikTok: https://tiktok.com/@mediobykgmedia Read about us on: https://kolom.kompas.com/Medio.KGMedia Saran dan kolaborasi: podcast@kgmedia.id
394zoq747jdecem0pbExuI,Kwentong Takipsilim Pinoy Tagalog Horror Stories Podcast,"Ang Kwentong Takipsilim Pinoy Tagalog Horror Stories ay handog ang mga nakakatakot na kwento. Dadalhin kayo sa mundo ng hiwaga, katatakutan at kababalaghan. Mga aswang horror stories, engkanto, multo horror stories, tagalog mystery stories, at kung anu-ano pa. Mapa-true story tagalog horror man o tagalog fiction na kukurot sa inyong mga puso, magpapakilabot ng inyong katawan at magbibigay ngiti sa inyong mga labi.Visit our Youtube Channel for more stories : https://www.youtube.com/c/KwentongTakipsilimTagalogHorrorStories Hosted on Acast. See acast.com/privacy for more information."
3awE4LqJisB86roNLL16E0,Pena Tua ( Podcast Horor ),"Kumpulan Cerita Dari Youtube Pena Tua ,Jangan Lupa Di Follow & Kirim Pesan Ke Instagram Penatua.official Untuk Berbagi Pengalaman Horor pendakian,Tragedi,Sejarah  Terimakasih"
7cIYTvLd8QgwirW7EhCAGH,Proof: A True Crime Podcast,"Proof: A True Crime Podcast is a serialized investigation into cases of potential wrongful conviction. Hosted by Susan Simpson of the Undisclosed Podcast and Jacinda Davis of TV’s Evil Lives Here, Proof unravels the tangled and competing demands of the legal system, police practices, truth, guilt and innocence. Season 2: The second season of Proof: Murder at the Warehouse takes Susan Simpson and Jacinda Davis to Manteca, CA where they reinvestigate the murder of 18-year-old Renee Ramos. On June 5, 2000, Ramos’ body was found buried under a pile of debris inside the shell of a new Home Depot building. Despite tips hinting at alternate suspects - tips that were ignored until now - Renee’s boyfriend, 18-year-old skateboarder Jake Silva, and Ty Lopes, the 33-year-old uncle of one of Jake's close friends were arrested for her murder. The questionable testimony of a 14-year-old boy was the key evidence used to convict them both to life in prison. Twenty-three years after Renee Ramos was murdered, Jake Silva remains in prison and maintains he is innocent. In season two of Proof: MURDER AT THE WAREHOUSE, Susan and Jacinda travel the streets of Manteca, reinvestigating the case against Jake and Ty – and in the process uncover long-overlooked evidence about what really happened to Renee Season 1: In season one of Proof: RUSSIAN ROULETTE Susan Simpson and Jacinda Davis reinvestigate the murder of Brian Bowling. On an October night in 1996, a gunshot rattles the walls of a double-wide trailer on the outskirts of Rome, Georgia. 15-year-old Brian Bowling is laying on the floor of his room, head bleeding from a gunshot wound. By the next morning, Brian is dead. Investigators quickly conclude that Brian’s wound was self-inflicted, the tragic result of teenage bravado. And yet within six months, two friends are arrested and accused of plotting to kill Brian. Cain Joshua Story and Darrell Lee Clark are convicted and sentenced to life in prison. An evil teenage plot? A horrible tragic accident? Or, a blatant miscarriage of justice? In this first season of PROOF, Susan and Jacinda drive the back roads of Rome, searching for the truth. Visit our website for episode transcripts, case files, behind the scene photos and more.  Follow us on social media. On Instagram, Twitter, and Facebook we are @proofcrimepod. Listener questions or tips about any of the cases we cover are welcome @proofcrimepod@gmail.com. "
4BGhG8AfdUdps06ryVFSUF,lvlymiranda,🐢
6sind3WztpVUo0Y8tXURto,IRSYAHAR Podcast,"Motivasi, Inspirasi, Inovasi dan Edukasi."
4ShS4acXTzoFA6jHZES1GH,Jejak Kriminal,Mari telusuri bersama jejak kriminal yang berada di sekitar kita maupun mancanegara.  Dengarkan dan ikuti untuk mendapatkan kisah terupdate dari kami.  Real Story by 𝒥𝒿𝓁𝒾𝒸𝒾𝑜𝓊𝓈
27kuJ4wlFDxsimEQRJEayV,Muhammad Taha Al Junaid,"Muhammad Taha Al Junaid stepped into this world in the Kingdom of Bahrain.  He started to seek education in the discipline of Qur’an sciences by enrolling himself into the center of Quran memorization: Abdel Rahman Ajour in Hamad city, Bahrain which led him to by heart twenty parts (Hizb) of the Quran.  Muhammad Taha Al Junaid  has numerous accolades of high merit to his credit namely securing first positions in most of the Qur’an recitation competitions along with also winning the prestigious Sheikh Ibn Baaz contest, in Quran memorization and Tajweed which was organized by the Islamic Education Association not to forget achieving one of the top ten places in Jalawi Bin Dhawi Al Otaibi competition in Quran memorization and Tajweed and also securing first position in the Holy Quran competition in Bahrain radio which was organized by the Ministry of Justice and Islamic Affairs."
4tyvfIEtwXkks2dR0kC91N,Podcast Kamar 75 - Cerita Sejarah,Podcast yang menceritakan sejarah-sejarah yang terjadi di Indonesia dan juga Dunia. Indonesia yang kaya akan suku dan budaya ini juga kaya akan cerita-cerita sejarah yang penting!  Simak cerita sejarah di Podcast Kamar 75 untuk menambah pengetahuan sejarah indonesia dan dunia!  Jangan lupa untuk Follow Instagram dan Twiter kami di:  IG: @podcastkamar75 Twiter: @75_kamar FB: @PodcastKamar75
3voIYI5x9ndOWIQPmx25Iz,PODCAST BELAKANG LAYAR By Briz Entertainment,"Buat Brizer yang ingin tahu tentang semua belakang layar dunia entertainment Indonesia gw Rizky (@rizky_briz) akan berkolaborasi sama manager artis, producer tv dll and hoping u get some inspiration !! Also Available on Youtube channel!!  For Sponsored/ Endorsement on Our Podcast Pls Contact :  +6287886677500 entertainmentbriz@gmail.com"
4h6qg1hmFYfX0qcwVuF0G4,Relaksasi Hangat,Audio relaksasi untuk tenangkan hati dan pikiran kamu. Dengarkan melalui earphone untuk pengalaman relaksasi yang lebih baik.
4GXeXPKCR6BRXn6Lxj3X5U,Tambalan Podcast,"Todong tawanan, iyakan, at kalat ba ang hanap niyo? Pwes, nasa tamang podcast kayo! Ito ang Tambalan Podcast! Ang tambalan ng isang balasubas at ng isang balahura AKA Nicole Hyala and Chris Tsuper! Powered by The Pod Network, and 90.7 Love Radio! Hosted on Acast. See acast.com/privacy for more information."
3XrqKNOzk1cD0fA1yKBx2m,Kidelis,assalamualaikum alhamdulilah dan sholawat kepada nabi kita muhamad ﷺ  Request surah? Dm @kidelis semua murrotal yang ada di postingan bukan asli punya kami melainkan dari beberapa account orang youtube artinya saya ambil audionya saja dengan ijin kemudian saya sebarkan lewat media ini agar lebih bisa di sebar luaskan saran dan keritikan sangat diterima dengan DM instagram sekian terimakasih
1Qf7XecqigJFclWIyihEoE,Spilled Pancake Batter,—⁺˖°ʚ🧸ɞ°⁺˖—                                                      ₊✩‧₊ socials are all under @shrrk.bait .🚬
7bm7WU7CiFG97sjowpBIwh,Edit songs♡︎,None of the audios are owned by me. Credits to their original owners.
1Xyx1wFm0zjasstcqhsF4F,Al caponera,Ai cover Song
3qZtPyyFQg7MQ1oiezHEMg,Podcast Begog,"Podcast mingguan perihal bocah begog yang semakin meresahkan warga +62, dipandu oleh @itahokok & @punkysdp yang sudah ahli dalam hal per-begog-an. Dengerin, supaya gak dewasa sebelum waktunya! Support this podcast: https://podcasters.spotify.com/pod/show/podcast-begog/support"
3JmvCejBZNbzvskb4EntHA,Eras Tour,Eras Tour Live
6PaZ1OpmDYW0s7HlxMgAuA,Anime ASMR Audios ,"Comfort, Anime and Spicy ASMR audios for your entertainment   Disclaimer: I do not claim to own or create any audios and artworks in this podcast. All material shown belongs to their rightful owner and creator  P.S Go check out my YUZUYA ASMR playlist for a full list of his ASMR Audios https://open.spotify.com/playlist/4Nrvy5892DgBsGLu46EjoI?si=_Mmb1Q_lQo-FZi2pSjEP1Q&utm_source=copy-link .~.~.~.~.~ https://anchor.fm/uzumaki-haseo/message .~.~.~.~.~ https://open.spotify.com/user/4ipwp7l22q11cz2uz7c9558un?si=OQycS0P8S7CbqUamZc05hQ&utm_source=copy-link"
5ISJgLQXgXRzeumkV4eR40,IELTS Speaking for Success,"Every week, Maria and Rory get together to discuss the latest IELTS Speaking topics, providing model answers and vocabulary to help you improve your general spoken English and achieve a higher band in your IELTS exam.  Our website: https://successwithielts.com Transcripts: https://successwithielts.com/podcast#transcripts Premium episodes: https://linktr.ee/sfspremium"
5Uxtoz4AnElTF3od4pvqSu,Greatmind,"Greatmind adalah sebuah podcast yang mengeksplorasi pemikiran para influencer tentang ide, aspirasi, dan advokasi mereka dalam hidup."
16QuJF5UmsWaAOidQhWyoD,Podcast Inspirasi Sukses,Podcast yang didedikasikan untuk memberikan inspirasi melalui ide-ide yang disadur dari buku self improvement untuk perjalanan pengembangan diri
2cOPmSX9QKDWqEht5KSNXO,Podcast Pengantar Tidur,Kumpulan Podcast yang dapat membuat tidurmu semakin nyenyak
3CUZcUgiKb8iEbwd5ldxCO,Podcast Cerita Cinta,Kumpulan cerita cinta yang dinarasikan ulang.  Instagram: podcast_ceritacinta YouTube: Podcast Cerita Cinta  Info: ceritapendek1905@gmail.com
6himx89vE1Y42vwtHBR9ly,Murottal Qur'an Terjemahan Audio Indonesia,"بِسْمِ اللَّهِ الرَّحْمَنِ الرَّحِيم Bismillahirrahmanirrahim (Dengan menyebut Nama Allah, Yang Maha Pengasih, lagi Maha Penyayang)"
1BOFoCKhrNQrZqZPOKjIJh,The Lazy Podcast,Tempat untuk mendengarkan podcast The Lazy Monday audio only
2CnfQ8ILpsIOebQFI0dVBo,Podcast Semi Horor,Sebuah podcast yang akan mengulas segala hal yang berkaitan dengan dunia gaib (tak kasat mata).  kami juga membacakan/menyampaikan cerita pengalaman horor kirirman dari kalian.  Kirim cerita kalian ke podcastsemihoror@gmail.com  Follow kami di sosial media  Instagram : @podcastsemihoror ( https://instagram.com/podcastsemihoror )   Twitter : @pod_semihoror
5f9YziqG4x1R2SzcbKWVli,Learn About Islam,"Our goal is to spread peace, unity, awareness, and a better understanding of the peaceful religion (Islam).Our content is based on the Quran and Authentic Hadith books which include the narrations of the Prophet Muhammad (peace be upon him), we do include opinions from scholars and speakers who try their best to explain the meanings of the verses and narrations.Verily, in the remembrance of Allah do hearts find rest (13:28)Contact: learnislamway@gmail.comBecome a supporter of this podcast: https://www.spreaker.com/podcast/learn-about-islam--5484193/support."
29mx2Lk24LPE5VpuLeViaF,Kajian Hijrah,"Share kajian-kajian keislaman untuk menambah keimanan dan ketaqwaan | Tadabbur Ayat - Ayat Allah | Berilmulah, maka Istiqomah Hijrahmu. #kajian #ngaji #hijrah #iman #islam #tadabbur #alquran Hosted on Acast. See acast.com/privacy for more information."
5MfQNeGILinrJFkf2UHLVK,The Adam Friedland Show Podcast,"Ladies and Gentlemen, the Adam Friedland Show."
5gr3ZuWUBPkItMJ7A7JqVU,Belajar Bareng Finance,"Sesuai namanya, Belajar Bareng Finance adalah podcast yang akan mengajak kamu belajar bareng mengenai seluk-beluk dunia ekonomi dan keuangan. Diinisiasi oleh Yudha Basuki - Dukung Podcaster: trakteer.id/belajarbareng/"
3crAQ2VOW9Ma8jTRIQGfFH,Idam Demus,"Belajar tilawah, murottal, doa-doa dengan irama/ilmu nagham Al-Qur'an di YouTube Channel IDAM DEMUS"
2hD3hFmbsk0KkeW4iw4Yxa,Podcast Tentang Mantan,"Hampir semua orang pernah punya mantan. Itu artinya banyak banget kisah yang bisa diceritakan, dan jadi pelajaran."
4cHlLV9PSc3rvd993Pir0a,"Startcast | Der Innovations, Business & Marketing Podcast","Max Ostermeier, ein leidenschaftlicher Entdecker im Reich der Start-Ups, taucht mit Neugier und Abenteuerlust in die inspirierende Gründerwelt ein. Sein Ziel ist es, tiefgründige Dialoge zu führen, um die Essenz der dynamischen Start-Up-Landschaft zu erforschen. Er verlässt sich dabei auf kritische, ehrliche Fragestellungen, um die echten Facetten unternehmerischer Abenteuer aufzudecken.Falls du mit Konzepten wie ""Skalierung"" und ""Bootstrap"" vertraut bist – großartig! Sollten diese Begriffe jedoch Neuland für dich sein, ist das absolut in Ordnung. Max hat das Talent, jeden mitzureißen und zu begeistern. Getreu dem bayerischen Motto ""Pack mas"" – wir packen das zusammen – sorgt er dafür, dass niemand auf der Strecke bleibt.In seinen Gesprächen mit den Gründern wird die spürbare Energie dieser Begegnungen lebendig. Die Herausforderungen, Ängste und Triumphe, die diese visionären Persönlichkeiten durchleben, werden nahezu greifbar. Max ist ein Meister darin, eine Kultur des offenen Austauschs zu etablieren, in der sich die Gründer wohl und ermutigt fühlen, ihre Erlebnisse zu teilen. Max, weit entfernt davon, oberflächlichen Ruhm zu verbreiten, sucht nach den echten, ungeschönten Geschichten hinter Erfolg und Scheitern. Seine Fragen kratzen nicht nur an der Oberfläche, sondern dringen zum Herzen der unternehmerischen Leidenschaft vor.Max versteht, dass Unternehmertum kein einfacher Pfad ist, glaubt jedoch fest an die Unterstützung für jeden, der den Mut hat, einen Unterschied zu machen. Sein Enthusiasmus ist ansteckend; er motiviert nicht nur die Gründer, sondern auch jene, die am Anfang ihrer eigenen unternehmerischen Reise stehen. Von München aus, einem Zentrum für Innovation und Kreativität, erspürt Max Ostermeier den globalen Puls der Start-up-Welt. Mit seiner Hingabe für authentische Erzählungen und der Suche nach tiefgreifenden Einblicken führt er Gespräche, die nicht nur informieren, sondern auch den wahren Geist des Unternehmertums verkörpern. Get bonus content on Patreon Hosted on Acast. See acast.com/privacy for more information."
1FEqaAc5S79CBA53EpQfeM,TONG LONTONG,Tempat ngalor ngidul kesana kemari.
3HUqlpVOlzQnweuBG0cvUp,PODCAST BEBAN ISTRI,"sebuah perbincangan antara 2 orang suami, renne nesa dan heri horeh, yang sudah tidak lagi menjadi beban negara tapi jadi beban istri. kebanyakan sih ngomongin soal serba-serbi rumah tangga, relationship, bapak-bapak life, dan cerita rakyat honduras. tayang setiap hari selasa jam 16:00 (kecuali spotify tutup)"
6N7Dz9heIBZu9rGf3u16ga,Ippho Santosa Podcast,"Ippho Santosa adalah motivator Indonesia yang go international, dengan penjualan buku lebih 1 juta eksemplar (melampaui predikat mega-bestseller) di antaranya:  7 Keajaiban Rezeki,  Success Protocol, dan  Marketing with Love  Saat ini publik mengenalnya sebagai:  24 Tokoh Kebanggaan Indonesia 2013 (Versi RCTI), Penulis Inspiring (MURI Award dan IKAPI Award), Pembicara Internasional (di Belasan Negara 5 Benua), Pendiri TK, SD, dan Kampus (70-an Cabang), 20 Mentor Pilihan 2016 di Kementerian Pendidikan, Pemilik British Propolis"
0oMoeOB8hO5l9fmxHP0DXK,Podcast Ngomongin Setan,Siniar Horor-Komedi yang dibawakan oleh Septiyan Ahmad & Aprizal Wahyu. Tayang tiap malam Jumat! Email: kotaksurat.pns@gmail.com. Support this podcast: https://podcasters.spotify.com/pod/show/podcast-ngomongin-setan/support
