id,name,description
5D1T4FsxhysIc6EyGixHcW,Resah,"Resah adalah tempat berkeluh kesah favorit para remaja. Kami bercerita tentang kebimbangan, polemik, keluh dan gundah para remaja dan mengambil solusi menurut cara pandang kami. Selamat mendengarkan celotehan kami!"
70vbKVVuvrYND5At9XTmMX,WillyKun Podcast,"WillyKun Podcast adalah Official Podcast dari Willy Kun, seorang youtuber yang memiliki segudang cerita misteri dan horror. Podcast ini akan membagikan ceritanya kepada kamu setiap 3x seminggu untuk menemani aktifitasmu dengan asupan mistis! Jangan lupa follow agar tidak ketinggalan setiap episodenya!"
2O2ala7Mqt3II51YIhto2N,オールナイトニッポンPODCAST 土曜日【5月は『滝音』】,『オールナイトニッポンPODCAST』土曜日は月替わりで今話題の実力派芸人が登場！2024年5月を担当するのは「滝音」！ 過去に担当したパーソナリティ・2021年　Gパンパンダ（10月）、ランジャタイ（11月）、まんじゅう大帝国（12月）、クールポコ。(年越し特番)・2022年　ママタルト（1月）、XXCLUB（2月）、高田ぽる子とやす子（3月）、モグライダー（4月）、エルフ（5月）、カミナリ（6月）、ガクヅケ（7月）、ラバーガール（8月）、かが屋（9月）、パンプキンポテトフライ（10月）、ぱーてぃーちゃん（11月）、怪奇！YesどんぐりRPG（12月）・2023年　ヤーレンズ（1月）、キュウ（2月）、ジャガモンド（3月）、ニュースター（4月）、ニッポンの社長（5月）、ストレッチーズ（6月）、カカロニ（7月）、ラパルフェ（8月）、さすらいラビー（9月）、男性ブランコ（10月）、ジグザグジギー（11月）、東京ホテイソン（12月）、クールポコ。（年越し特番）・2024年　令和ロマン(1月)、なすなかにし中西（2月）、9番街レトロ（3月）、梵天（4月）、滝音（5月）
2B4esGP29I1GUIg7SxHXuW,Der Animus Podcast,"Der Nr.1 Musik Podcast in Deutschland, ab jetzt jeden Mittwoch um 20.00 Uhr! Folgt uns um keine Episode zu verpassen.Kooperationen/Anfragen: deranimuspodcast@gmail.com Hosted on Acast. See acast.com/privacy for more information."
4k184aScmJZAUbOr7mRXGx,Buddhist Podcast,Buddhist Podcast akan berbagi sharing semua tentang Dhamma. Support this podcast: https://podcasters.spotify.com/pod/show/bpo/support
2jZzFdozOCSPAyH4JNXCly,Podcast OLI - Obrolan Laki-Laki,"Obrolan laki-laki yang ber-genre setengah komedi.   Setiap Minggu, @jordankvos akan ngobrolin tentang keresahan-keresahan kehidupan laki-laki. Udah yuk dengerin aja, siapa tau bisa bikin kamu senyum-senyum sendiri. KALO GAK OLI HMMMM LEMAZ!   Yang mau cerita, mau bercanda, mau tanya-tanya, mau ngadu, atau mau salam-salam boleh email ke podcastoli19@gmail.com   Jangan lupa dengerin Podcast OLI dimanapun kamu berada. Terima kasih!"
6yMZ5T2mbFeXyYAuZ6r4pF,PODCAST TERROR | TEMAN HORROR,"Selamat datang di ""PODCAST TERROR - Teman Horror"" tempat di mana kamu bisa merasakan sensasi mencekamnya cerita horor dengan sentuhan santai ala tongkrongan. Di sini, kita akan membahas dan berbagi cerita-cerita seram dari berbagai sudut pandang, mengajakmu untuk tenggelam dalam dunia gelap yang penuh misteri.  Kamu akan disambut dengan suasana yang nyaman dan hangat, seolah-olah sedang duduk bersama teman-teman dekat di malam hari."
6DcXGMb8M4fZhBWmmuD1Hs,Rangkum Mistis,Podcast horor yang mengudara setiap Senin dan Kamis. Merangkum cerita cerita mistis yang beredar. kirim cerita kamu lewat email di rangkummistis@gmail.com.
7jdjc8pV4OebiTWlcxmov2,TimnasGoalPodcast,"TimnasGoalPodcast, Live Setiap Senin Malam Pukul 21.00 WIB [LIVEonNOICE] host Amdan Ramadhan,  Pandit Coch Febri dan Mimin Purnomo • powered by @timnasgoal"
6Wma3TTRO8EeO1pgqOvmk4,ayshteru,a collection of random noises
6RKpYdyOmKvqC8EyfeP3L6,Podcast TersilauwU,Berbagi keresehan dalam perspektif yang beragam | Temui kita di berbagai sosmed @faisalbakti @abizaralwahda_ @rizqi_ismail @podcasttersilauwU | tersilauwupodcast@gmail.com
6KrAgsROcuhsmTdhyDabDI,Kerja Kelompok Podcast,"On Wednesday & Saturday Follow and Subscribe on our Platforms Spotify, Noice dan Apple Podcast  Kerja Kelompok Podcast Jimly dan Aul pengen buat Podcast di sektor Komedi Tongkrongan  Yang semoga Panjang ya Trupersss"
1Ovsn8bAE2lzC2Skzjq0Jl,LLV Podcast,"Podcast yang ngebahas tentang hal-hal yang lagi viral, dari enternain, tiktok, food dan sport. Pokoknya pembahasannya bakal seru banget deh karna dipandu 3 host kece, ada Ompong, Rian, dan Arman."
4If94mSNbVPvMomSNUfWUw,DAS PODCAST UFO,"Zwei Grenzgänger widmen sich den Themen unserer Zeit. Der Erlebnis-Podcast für lange Autofahrten oder Radtouren. Unterhaltsam, wenn man nebenbei was Unterhaltsames macht. Mit Florentin Will und Stefan Titze. Hosted on Acast. See acast.com/privacy for more information."
4AaaqtAaNBj9Urt6UbiTED,Podcast Lampu Tidur,"Dari pada bengong nggak bisa tidur, mending dengerin Podcast Lampu Tidur. Topiknya (semoga)enak untuk di perdengarkan menjelang waktu tidur. Support this podcast: https://podcasters.spotify.com/pod/show/podcast_lamputidur/support"
0M2B2pV7OinFpkiFCcu6LI,Podcast The Scary Story,"Hallo semuanya selamat datang di podcast the scary story, podcast ini akan menceritakan kisah horor berupa dari urban legend, cerita rakyat dll masih banyak lagi Bagi kalian yang ingin mengirimkan cerita / pengalaman horor linknya ada dibawah atau bisa juga kirim melalui email DM ig juga bisa, kalo ada pertanyaan bisa langsung aja DM instagram ya Kirim cerita kalian :  Instagram : https://www.instagram.com/podcastthescarystory/?hl=id  Email: aryoerlangga00@gmail.com"
1pjU1f2PfoIf4NS3eYT925,LOONA,Stan LOONA yall!!!
1T1aQ513JYHNysKB2Ifkb1,Podcast Keseharian,podcast yang membahas masalah hidup dari biasa sampai absurd dan pastinya bisa menemani kalian setiap minggunya.  Hosted by Aditya deriza. email: podcastkeseharian@gmail.com
28p4HN3d7C6SU84V1IhMYG,PODCAST SCIENTIST,"Podcast yang membahas semua yang ada disekitar kita dengan sudut pandang yang tentu saja jenius. Dibawakan oleh Patrick, Fajri MRP, Papa Musa, Bayu Yatno"
1vZanBOTFGONp98t1AoAjQ,Podcast Ngefans Sante,"Podcast yang membahas seputar dunia JKT48 bersama Abduh, Tara, dan Sahala.   Twitter: twitter.com/NgefansSante Instagram: instagram.com/ngefans.sante Email: podcastngefanssante@gmail.com"
4QMapcexez7tFb6RoU4Unj,PODCASTnya MAYA,"Namanya Sugeng Dalu dan per tanggal 11 Juli 2020 berubah jadi PODCASTnya Maya karena pengen aja 😂 . 100% isinya bermanfaat bagi yang gabut. So, selamat datang ya !. 🤍"
0gHrxKGdceVu7YOCqfRxqm,Podcast et Méditations par Nathalie LAURENCE,"Bonjour et bienvenue sur ma page.  Je me nomme, Nathalie Laurence, je suis sophro-relaxologue, énergéticienne, et formatrice.  J'ai pratiqué cela de manière courante à mon cabinet pendant plusieurs années. J'ai plaisir à vous partager des ressources pour vous apaiser, vous ressourcer et vous permettre de vous sentir mieux jour après jour.   Développez votre spiritualité en étant totalement incarné. L'une de mes devises est : Avoir la tête dans les étoiles en gardant les pieds sur Terre.  Retrouvez-moi régulièrement pour de nouveaux podcasts et méditations guidées.  Bonne écoute. Nathalie. Hébergé par Ausha. Visitez ausha.co/fr/politique-de-confidentialite pour plus d'informations."
18w7B5lkZrZxdeeDsJoTqN,Sleep Triggers,"hello! I am a hypnosis anchor, here you will hear all kinds of wonderful voices, let us relax and walk into this wonderful place!  thank you for your support.  Support this podcast: https://podcasters.spotify.com/pod/show/jiom4/support"
3mMQQZQq3Fd5ZlGcZmiaYR,Podcast Kuat,"Podcast berisi empat orang yang bernama Kohi, Umar, Azrok, dan Thomas dengan obrolan yang kurang bermanfaat dan rilis tiap hari Kamis di YouTube dan Spotify   Follow Instagram kami: @podcast.kuat"
634jBlDTZESghLpqzF6d6r,Warfare Prayers Podcast-The Morning Prayer,"Join the Morning Prayer Podcast every weekday morning at 7:00 am. Pastor Derrick Crosby guided morning prayers to enrich your prayer life daily. Be inspired by morning prayers, and scripture readings that will keep you encouraged, and motivated to seek after God, remain in His presence and strengthen your faith as you follow the leading of His Spirit daily. My prayer is that you will see the power and glory of God, feel the love and grace of God, and sense the peace and presence of God in your heart as you listen to this morning devotional podcast. Join me every weekday morning! Episodes released at 7:00 am.Become a supporter of this podcast: https://www.spreaker.com/podcast/warfare-prayers-podcast-the-morning-prayer--5866282/support."
4SQKFZhlP6oJ1MyTlPx9uH,Podcast Firda Situmorang,Kita harus selalu berani untuk capai apapun yang kita mau dengan menjadi diri sendiri yang lebih baik setiap harinya. Podcast Tayang setiap selasa dan jumat. Instagram : firdayanisitumorang
5EsGCfOgJtsUjVSU7sWf1y,Podcast Sejarah,Belajar dengan telinga rasakan dengan hati
2HGcJRYrjGnpce6bRp8UXm,The Psychology of your 20s,A podcast that explains how everything is psychology. Even your 20s. New episodes every Friday! For business enquires please email thepsychologyofyour20steam@unitedtalent.com  New merchandise here: https://the-psychology-of-your-20s.myshopify.com/
3RYQGRLdQzBKNccXvx5W8S,Baking A Murder,If psychological thrillers & horror movies/books are your guilty pleasure - you're at the right place.  Brought to you by Rotten Mango hosts! Support this podcast: https://podcasters.spotify.com/pod/show/stephanie-soo/support
3IM0lmZxpFAY7CwMuv9H4g,The Daily,"This is what the news should sound like. The biggest stories of our time, told by the best journalists in the world. Hosted by Michael Barbaro and Sabrina Tavernise. Twenty minutes a day, five days a week, ready by 6 a.m.  Listen to this podcast in New York Times Audio, our new iOS app for news subscribers. Download now at nytimes.com/audioapp"
1HCF9OMp8ItCvFT1P3rC7x,Terra X History - Der Podcast,"Um ein komplexes Thema besser zu verstehen, lohnt sich oft ein Blick in die Geschichte. Denn hier beginnen die Dinge, die uns heute beschäftigen und das auch in Zukunft tun werden. ""Terra X History – Der Podcast"" geht mit Menschen aus Geschichtswissenschaft und Gesellschaft an die Anfänge zurück und fragt: Wie wurde unsere Welt so, wie sie ist? Und (was) können wir aus der Vergangenheit für die Gegenwart lernen?  Alle zwei Wochen auf www.terra-x.zdf.de und überall, wo es Podcasts gibt."
7a3LWj5xSFhFRYmztS8wgK,Lage der Nation - der Politik-Podcast aus Berlin,Wöchentliche Analyse der politischen Ereignisse in Deutschland und der Welt - mit Philip Banse und Ulf Buermeyer
2JrRIt5eWXVyYlFZDaljGo,Iloveliaa,"🝮︎︎︎︎︎︎︎!!🚫WARNING NOT NOT MINORS🚫!!  🝮︎︎︎︎︎︎︎Hey!! You can call me Aurelia or Lia, not Liya🧍🏽‍♀️ 🝮︎︎︎︎︎︎︎ I would probably mostly upload M4F or M4M if anyone gives a recommendation which creator to upload, I'll probs take it 🝮︎︎︎︎︎︎︎!! Audios are not mine, credits to the people who uploaded them!!"
4Dp24VYkAQTfzqHvck3Trm,Elfel o Kaffe Podcast,"Ditt sällskap i byggboden! Podden består av Mathias 39, Adam 25 & Gustav 26 som alla tre jobbar som elektriker. Nytt avsnitt varje tisdag."
4WkDOrAK3uASgK2PRF7j9M,The MeatEater Podcast,"Building on the belief that a deeper understanding of the natural world enriches all of our lives, host Steven Rinella brings an in-depth and relevant look at all outdoor topics including hunting, fishing, nature, conservation, and wild foods. Filled with humor, irreverence, and things that will surprise the hell out of you, each episode welcomes a diverse group of guests who add their own expertise to the vast world of the outdoors. Part of The MeatEater Podcast Network."
4HVeRttT6tIsu7DuzUvqof,mythosva audios 🥰 part 6,SPOTIFY WHEN I CATCH YOU SPOTIFY (all creds to mythosva)(also discord link: https://discord.com/invite/teunKpWqWk)
2fDn3EgvJZ5J1k5rrBwrlZ,The Rest Is Football,"Join Gary Lineker, Alan Shearer and Micah Richards for a new podcast bringing strong opinions on all the latest stories from the world of football. Hosted by three men who’ve been there and done it at the highest level of the game, The Rest is Football combines topical debate with outrageous tales from their careers. The essential new podcast for football fans."
35Ntc5kndMt5uUCD3RtLhL,Are You Garbage? Comedy Podcast,Comedians H. Foley and Kevin Ryan are self proclaimed GARBAGE. Each week a guest gets put to the test to determine if they are in fact ”GARBAGE” as well. It’s like a trashy comedy game show. Do you steal the shampoo from hotels? Own a George Forman Grill? Ever worn JNCO Jeans? You’re Garbage.
32xrUpzAO9KP34KJyTRXPz,Encounter Podcast with David Diga Hernandez,Encounter the Presence and Power of the Holy Spirit.
1saTyIep25clWRFKSyfp6q,Belajar Branding,"Eksplorasi tentang brand, branding dan marketing   www.kawakibi.id  Free Konsultasi wa.me/628561395548"
45J7j5ulP81ZdBlsxcp5hZ,"Rich Dad's CASHFLOW Quadrant : Rich Dad's Guide to Financial Freedom, Full Podcast","Rich Dad's CASHFLOW Quadrant is a guide to financial freedom. It's the second book/Podcast in the Rich Dad Series and reveals how some people work less, earn more, pay less in taxes, and learn to become financially free.  CASHFLOW Quadrant was written for those who are ready to move beyond job security and enter the world of financial freedom. It's for those who want to make significant changes in their lives and take control of their financial future.  Robert believes that the reason most people struggle financially is because they've been spent years in school but were never been taught abou"
2VPwENEu6K4Gs29SmNjX0k,PADDOCK TALK Lucy Wiryono,"Mbak MotoGP hadir di YouTube dengan Paddock Talk versi audio visual. Nah ini versi audio : Paddock Talk Podcast. Analisa race, update berita MotoGP langsung dari rider-rider & teamnya hadir di sini."
2cQw8L6e7XXA90K1LpZekV,The Bull - Il tuo podcast di finanza personale,"The Bull - Il tuo podcast di Finanza Personale.  Tutto, ma proprio tutto, quello che devi sapere su risparmio e investimenti, senza fronzoli e tecnicismi inutili ma solo l'essenziale per imparare a gestire sul serio i tuoi soldi e costruire un passo per volta un futuro finanziario migliore per te e per la tua famiglia.  Settimana dopo settimana, con The Bull imparerai a gestire con semplicità il tuo budet personale, ad aumentare i tuoi risparmi senza compromettere il tuo stile di vita, ad incrementare i tuoi guadagni prendendo decisioni migliori sulla tua carriera professionale.  Ma soprattutto imparerai come investire davvero i tuoi soldi, con una prospettiva di lungo termine, solida e realistica, che ti porterà a rivoluzionare il tuo intero rapporto con il denaro e ad aprirti strade che non avresti mai immaginato."
42IRmmrvL87euGeZTVVuWG,Belajar Bahasa Jepang,Belajar bahasa jepang with jully
541rHIc6edZh481vUH1rN5,RUMAH NONY - Rumahnya Nodi dan Sony,"Nyesel kalo gak ngikutin obrolan super panas, super kacau, super ngaco. Gokil, no baper, positive thinking. ""RUMAH NONY"", Program paling keren abad ini. YUK KENALAN!!!!! Setiap Hari Selasa pkl 19.00 wib dan Goplay setiap pkl 12.00 dan Anchor setiap Rabu Pkl. 12.00 Yang menarik untuk disimak"
0vGalOGqauOr75YrTrYsut,Podcast Ng Mga Walang Jowa by BINI,"Para sa mga single at ‘technically single’ Para sa mga naging di masyado brainy sa ngalan ng pag-ibig Para sa mga nagpa-bebe, kinilig, at nagmahal Pero. Hindi. Pa. Rin. Naging. Official. Jowa.  Kung iniisip mo if normal lang ang feelings mo sa di mo naman talaga jowa, here’s a perspective on love and relationships (or the lack of!) from eight modern-day GenZ Filipinas-slash-P-Pop idols.  “Podcast ng mga Walang Jowa” fresh episodes, Thursdays at 10AM."
3lgr1aXURWt8EUPljDC8Az,Narasi Misteri,"Selamat datang teman cerita!  Podcast Narasi Misteri mendatangkan langsung Narasumber dengan cerita pengalaman pribadi yang dialami langsung dan sangat menarik untuk kalian dengarkan. Host kita, Randy Mulia akan membawa kalian masuk ke dalam berbagai alur cerita yang diluar nalar tapi terjadi dan dialami langsung oleh narasumber. Jangan lupa follow podcast ini dan follow juga social media Narasi Misteri! Untuk kalian yang punya pengalaman di luar nalar bisa DM ke instagram Narasi Misteri."
3NJJ6DihdICn4rzt0AAu5J,Soleil's Episodes ,"₊˚🖇️✩ ₊˚🎧⊹♡  HIII!! My name is Soleil and this is my second podcast. It's a f4f audios podcast that takes requests too, so if you have any ideas or if you're hoping to hear something in particular, just let me know! My last podcast was taken down but don't worry, I'm not giving up just yet. If this one gets taken down, my next pod will be called ""soli episode's >w<"" mwah thank u for supporting me!! Also please, vote my podcast 1 star or even better, don't vote it. My M4F podcast: https://open.spotify.com/show/68Riune8qdKOBCN9X5NtyT?si=-0BIKr6_QwKAsP5qChjQMw"
1HPzGnPSSrYrybvKZ3u2n6,Rusuh Disini ,Rusuh Disini adalah siniar podcast nomer satu di Indonesia dengan dua penyiar populer Gung Bagus dan Gung Gede.
6ZgIPWLjYDaZplyTLop3If,Sisi Sadar,Podcast Horor Komedi bukan untuk si pemberani. Tayang setiap malam Jumat. Kirim cerita pengalaman horor kalian melalui Instagram kami @sisisadar
4h0QFo3NRm7qsOhA6i0hC0,Mystères & Inexpliqués - Le podcast sur les affaires paranormales,"Spiritualité et ésotérisme, superstitions et légendes, transcommunication ou expérience de mort imminente (EMI), fantômes et chasses aux sorcières, mystères et mediums, aliens et OVNI, de la forêt de Brocéliande à la Zone 51 : dans le podcast ""Mystères & Inexpliqués"", découvrez une série d’entretiens avec des personnalités venues de différents horizons pour explorer toutes ces affaires paranormales.  ""Mystères & Inexpliqués"" est un podcast créé par BTLV, adapté et diffusé par Europe 1.  Parmi les invités de ""Mystères & Inexpliqués"", le podcast sur les affaires paranormales, retrouvez Patricia Darré, Jean-Claude Capelli, Nicolas Mezzalira, Laurence Baranzski, Pascale Lafargue, Joslan F Keller, Jean-Pierre Luminet, Christelle Dubois, David Perrou, Anne Moyat, Jean-Marc Bernad, Christian Doumergue ou encore Stéphane Royer. Au micro de Bob Bellanca, dans une production diffusée à l’origine sur BTLV.fr, tous se livrent et explorent les phénomènes paranormaux, des plus anciens comme ""Les mystères de l'île de Pâques"" aux plus récents autour de l’ufologie. Bonne écoute !  Production : Hugo Maze-dit-Mieusement pour Europe 1 Studio  Visuel : Axelle Maurel avec Sidonie Mangin  Direction artistique : Xavier Jolly  Enregistrement Voix : Marc O. Grunfeld et Victor Naulleau  Direction de l’Innovation : Jamal Lassiri Médiatisation : Lagardère Publicité News "
2XaC1jCHIVHuRcpBIja4Jg,ランジャタイの伝説のひとりぼっち集団［オールナイトニッポンPODCAST］,ランジャタイ（伊藤幸司、国崎和也）が担当するオールナイトニッポンPODCAST、『ランジャタイの伝説のひとりぼっち集団』！ 毎週火曜日18時ごろ配信！
3YtOu9VxpupAuw0WYyKlI8,Football Espresso Podcast,"Podcast Sepak Bola Pragmatis, Dosis Sepakbola Rendah Kalori"
1Rwh7v7Pl2KdBOJXxcverD,Das erste Mal in Westeros - Game of Thrones Rewatch Podcast,"Was passiert, wenn jemand, der Game of Thrones nie verfolgt hat, die Serie das erste Mal schaut und die Folgen anschließend mit einem Nerd diskutiert? Richtig: Absurde Vorhersagen, krasse Emotionen, lustige Kommentare und interessante Gespräche über mögliche Plot-Holes und Fan-Theorien. Alicia Joe hat noch nie Game of Thrones geguckt. Naja, bis jetzt. Denn Tim, seines Zeichens fanatischer Fan, hat sie dazu bewegt, die Serie (ganze zwölf Jahre nach Erscheinen) das erste Mal zu schauen. Egal ob Game of Thrones Nerd oder Neuling, bei diesem Podcast kommt jeder auf seine Kosten."
11NG5TRbl2jqGSrxdpiEQK,ION,"🎙️Podcast The Lion (ION) yang dimana podcast ini akan membicarakan tentang berita-berita yang lagi hits di sekolah dan juga tentang motivasi, cerita horor, pengalaman di sekolah, dan masih banyak lagi! Penasaran kan apa saja yang kami bicarakan? 🤔. Jadi pastikan terus teman-teman semua dengerin podcast ION dan jangan sampai tertinggal episode lainnya yaa !✨🦁"
3mAmLzk7Lp3JG5lYqGTj1T,Skitels Podcast,"Podcast yang semoga setiap minggu, berisi tentang obrolan obrolan seputar kehidupan sehari hari,mitos dan horror. yang di pandu oleh Bayu, Bimo, Dimas, Joko.  Peringatan : Podcast ini berisi cerita dan pengalaman absurd, dan terkadang mengandung 21+"
7sQvEMEJgs28jDW73ASXz3,Aleja y La Grúa PODCAST,"En este podcast vamos a aprender de la vida, vamos a hablar popo y vamos a contar un poco experiencias que tal vez nos ayuden a ser un poco mejores.  En varios episodios vamos a tener invitados, en otros voy a estar con mi novia y en otros voy a estar yo solito.  Asi que nada, muchas gracias si lo escuchan, nos vemos luego.  DISPONIBLE TAMBIEN EN YOUTUBE!!!"
1CzJXnRSWcZRtlnAVB3ugQ,The HonestBunch Podcast,"Thanks for taking time out to listen to another episode of our podcast,pllease check us out on socials.https://www.youtube.com/@glitchafricastudioshttps://www.instagram.com/thehonestbunchpodcast/#thehonestbunchpodcast #glitchafricastudiosThe Honest Bunch Podcast ( FKA Frankly Speaking) is Glitch Africa's flagship audio-visual podcast that focuses on discussing real millennial and Gen z issues with no holds barred. There are 4 main personalities on the show - Nedu, Husband Material, Toun and Ezinne. The cast members bring their unique individual personalities and wit to the show. Occasionally, a guest is brought on to share opinions on topics tailored to their experiences, interests or personalilties.With episodes released , the topics are carefully curated to cover areas of society, life, relationship & sex, career, culture, religion, finance and lifestyle.Frankly Speaking has the the fastest growing audience for any podcast in Nigeria at the moment. The edge of the show is the method of delivery. The conversations, humour and reactions of the cast members are completely unrehearsed and unscripted.At The Honest Bunch, we are telling original Nigerian realities from a lens of the youth. The show is stupendously funny, inconceivably revealing, somewhat shocking and yet unequivocally informative."
6X7RCiq7a1U8FQtYLzj01p,PODCAST SEBATAS TONGKRONGAN,Sebatas tongkrongan adalah podcast yang bertajuk membawa obrolan dalam tongkrongan mengenai isu-isu dan obrolan tentang sisi dibalik gemerlap jogja dan sekitarnya. fokus pembahasannya adalah tentang bagaimana suatu tongkrongan menanggapi isu dan berbagai fenomena yang ada dalam lingkup masyarakat dan media sosial
4JzBtHMATquYJDLSoXJWs1,ANI Podcast with Smita Prakash,"ANI Podcast with Smita Prakash gets eminent people from different walks of life to talk about issues that impact you and society at large. Join Smita Prakash as she brings important voices from the field of politics, sports, entertainment, and lifestyle. Dive in for a great listening experience brought to you by India’s largest news agency."
3afgwb9O6nbraC5JdI7ucV,PODCAR (Podcast Pacaran),"Hai ! Kami adalah PODCAR, alias PODCAST PACARAN ! Kita di sini bakal ngobrol-ngobrol aja tapi direkam. Biasa topiknya kita bahas relationship sampai adulting life.. (huaaa)  Kalo suka, follow dan kasih rating di Spotify ya ⭐️"
3ASqh4Vg0Xid4a0C9OsidA,Podcast Rono Rene (Podcron),"Hiburan, guyonan yang mungkin tidak manfaat tapi dijamin tertawa."
1S8uirsUcS6vt0wAThGJnE,Smart People Award Podcast,Deskripsi podkes ini ? Mohon sumbangan nya biar kami bisa beli soundcard baru
2uCEYmdRF76YrKAEkCtmbi,Improvedu Podcast,Di sini Mentari akan mengulik hal-hal yang berkaitan dengan pengembangan diri pada remaja usia belasan hingga dua puluh tahunan
0rG2bu3KZF84ZxHhPpoiuJ,Podcast Tenang,"Podcast Tenang adalah tempat berdialog diri menumpahkan khawatir, takut, kecewa dan segala rasa untuk ketenangan jiwa."
1quLEnN2lMULWXMu6Wqpc7,Podcast 7:12,Celotehan wota reboost tentang apa yang dialami dan diamati di fandom JKT48
185w8O8CHySKjowi24xFBH,Podcast Lista,"Hai, Selamat datang di podcast “Listalk”, tempat kita ngobrolin segala hal tentang mimpi, romansa, dan kehidupan pertemanan. Di sini, kita bakal bahas cerita-cerita yang bikin kita senyum pas lagi tidur, dari mimpi yang bikin baper sampai yang bikin kita ketawa kebangun.  Setiap episode, aku bakal bawain monolog-monolog yang relate banget sama kehidupan sehari-hari. Kita ngomongin soal cinta yang kadang bikin melayang, tapi juga bisa bikin jatuh ke jurang. Terus, kita gak lupa ngobrolin soal sahabat yang selalu ada buat kita, baik pas lagi up atau down."
6IUw0GZbJtMsXetz6PI5uX,Je Favoriete Podcast,"Clubs, films, steden, eten, podcasts: van werkelijk alles heb je wel een favoriet. En aangezien het je favoriet is, heb je er waarschijnlijk ook een goed verhaal bij. Tenzij je niet kan praten, maar daar hebben beste vrienden Stefan de Vries, Julia Heetman en Sean Demmers geen last van.Geproduceerd door: Tonny Media. Hosted on Acast. See acast.com/privacy for more information."
30m7GtMv1zqsRnnjGzR73U,Podcast Idaman Indonesia,Podcast Idaman Indonesia Karena Yang Lucu Bisa Jadi Idaman 🎙️ Business inquiry: 💌 Direct Messages 📞 Manager 0856-4700-6770 📩 podcastidaman.id@gmail.com   Jangan Lupa Follow akun kita ya! @podcastidaman @luckypanjiasmoro @firmanrafiandy @warung_hik @ckrbn_
2H5xwdoVqh2iM3mIMZdi7v,MAIN Podcast,MAIN Podcast hosted by Yudist Ardhana.  Podcast ini juga tayang di Channel Youtube MAIN Media ID.
7FdwxgIM3BCma4c4KTT3xV,Fenomena Podcast,"Mistis. Konspirasi. Sejarah. Dan Budaya. | Upload setiap Senin (Konspirasi, Sejarah dan Budaya) dan Kamis (Mistis) | Bagi anda yang ingin mengirimkan cerita atau menceritakan pengalaman mistis anda di 088227892319 (Whatsapp)"
