id,name,description
39O7rn9wXKazF34d9jKoo3,Flavs The Podcast,"We are the music festival of Hip-Hop, Soul, n RnB in Indonesia. We are having this Podcast to talk about the culture itself."
6KrAgsROcuhsmTdhyDabDI,Kerja Kelompok Podcast,"On Wednesday & Saturday Follow and Subscribe on our Platforms Spotify, Noice dan Apple Podcast  Kerja Kelompok Podcast Jimly dan Aul pengen buat Podcast di sektor Komedi Tongkrongan  Yang semoga Panjang ya Trupersss"
0rxodGkGdiW3C98uICQDIo,Gadget Podcast By Fosfor Indonesia ,"Podcast Gadget pertama di Indonesia yang membawakan review gadget terbaru, memberikan tips and trick dan juga pembahasan berita seputar gagdet yang sedang hot. Instagram @fosfor_ig For business enquiry : +628388586586"
1LPtxau14QJyV6lorE9wyJ,INDONESIAN AVAKIN LIFE PODCAST,Haloo sobat Avakiners Indonesia  Selamat datang di avakin podcast Indonesia   -informatif -menghibur -inspiratif -update -shareing
2H5xwdoVqh2iM3mIMZdi7v,MAIN Podcast,MAIN Podcast hosted by Yudist Ardhana.  Podcast ini juga tayang di Channel Youtube MAIN Media ID.
4AaaqtAaNBj9Urt6UbiTED,Podcast Lampu Tidur,"Dari pada bengong nggak bisa tidur, mending dengerin Podcast Lampu Tidur. Topiknya (semoga)enak untuk di perdengarkan menjelang waktu tidur. Support this podcast: https://podcasters.spotify.com/pod/show/podcast_lamputidur/support"
2jZzFdozOCSPAyH4JNXCly,Podcast OLI - Obrolan Laki-Laki,"Obrolan laki-laki yang ber-genre setengah komedi.   Setiap Minggu, @jordankvos akan ngobrolin tentang keresahan-keresahan kehidupan laki-laki. Udah yuk dengerin aja, siapa tau bisa bikin kamu senyum-senyum sendiri. KALO GAK OLI HMMMM LEMAZ!   Yang mau cerita, mau bercanda, mau tanya-tanya, mau ngadu, atau mau salam-salam boleh email ke podcastoli19@gmail.com   Jangan lupa dengerin Podcast OLI dimanapun kamu berada. Terima kasih!"
1XpP6f4BshhgaJrgE9crZt,PSJTV,PSJ TV Adalah Sebuah saluran Televisi yang dapat mendefinisikan kebanggaan dan jiwa kota Jakarta dengan menyajikan berbagai program-program menarik dan hangat
7ANWALdYcuj5ZJfHkSQyWu,Podcast Tentang Jepang,Sebuah podcast yang berbicara tentang Jepang
6X7RCiq7a1U8FQtYLzj01p,PODCAST SEBATAS TONGKRONGAN,Sebatas tongkrongan adalah podcast yang bertajuk membawa obrolan dalam tongkrongan mengenai isu-isu dan obrolan tentang sisi dibalik gemerlap jogja dan sekitarnya. fokus pembahasannya adalah tentang bagaimana suatu tongkrongan menanggapi isu dan berbagai fenomena yang ada dalam lingkup masyarakat dan media sosial
6ArwCfJkuTxyDbK6s1oRqI,Podcast Himra,"Podcast Himra adalah salah satu program kerja dari Himpunan Mahasiswa Manajemen Rekod dan Arsip yang berasal dari Program Pendidikan Vokasi, Universitas Indonesia. Podcast berisi pengalaman-pengalaman selama perkuliahan di program studi MRA."
6RKpYdyOmKvqC8EyfeP3L6,Podcast TersilauwU,Berbagi keresehan dalam perspektif yang beragam | Temui kita di berbagai sosmed @faisalbakti @abizaralwahda_ @rizqi_ismail @podcasttersilauwU | tersilauwupodcast@gmail.com
3c0NCxgbsni081CsBEJ608,Learning Indonesian with the Expert!'s Podcast,This podcast is created for those who are avid  in learning the Indonesian language and culture.
3E6aSsPxDUIvJBP6PgRvG4,Vodcast Indonesia,"Ngobrol ngalor-ngidul soal dunia Voice Over yang ternyata LUAS BANGET! Available at Noice, Spotify dan Google Podcast"
6kTdzzSm9FT8pKeE5hecD4,Cyber Defense Indonesia,"Cyber Defense Community Indonesia (CDEF) is a community that focus in incident, detection & response, threat hunting, security hardening, security monitoring, digital forensic, security awareness, security policy, etc  For more information, click here https://linktr.ee/cdef.id"
2u9kwSYi0r8oHb34ML2D9b,••Podcast Kejar Tayang••,"""Podcast Kejar Tayang"" is not a specific or well-known podcast that I am familiar with. It is possible that ""Kejar Tayang"" is a term or phrase in Indonesian language that refers to the process of trying to get a podcast published and gaining listenership."
3PtGV4cZ6rS6mRBqomGx47,Podcast Indonesia Menalar,"Lahir sebagai bentuk keprihatinan atas lemahnya nalar kebangsaan dan kecenderungan sofistik yang makin meluas, Indonesia-Menalar (IM) mendedikasikan diri sebagai media online yang fokus menjalankan misi memprovokasi nalar dengan cara mengembangkan diskusi publik dan menawarkan gagasan-gagasan kreatif-inovatif.IM memuat konten yang didominasi opini maupun informasi-informasi berbasis media massa dan media sosial, juga berbasis penelitian (research)."
6T3zZSrF2rfkONkhDzlFhY,Ex Room Podcast,Ex Room Podcast adalah sebuah program talk show yang dihadirkan untuk memberikan wadah bagi para peserta X Factor Indonesia Season 4 yang telah tereliminasi untuk membagikan cerita mereka selama masa karantina X Factor Indonesia Season 4.   Ex Room akan dipandu oleh dua host yang juga alumni X Factor Indonesia dari season sebelumnya.
02cJMc6RgGJfa6LZ35Ug4D,ASA PODCAST INDONESIA ,Podcast penuh harapan
1uKUdCmrS7SKbsx0YO3hOU,Podcast Indonesia Menalar,"Lahir sebagai bentuk keprihatinan atas lemahnya nalar kebangsaan dan kecenderungan sofistik yang makin meluas, Indonesia-Menalar (IM) mendedikasikan diri sebagai media online yang fokus menjalankan misi memprovokasi nalar dengan cara mengembangkan diskusi publik dan menawarkan gagasan-gagasan kreatif-inovatif.IM memuat konten yang didominasi opini maupun informasi-informasi berbasis media massa dan media sosial, juga berbasis penelitian (research)."
5faX6HRYLxnNRwrhFaJvky,The Sidetrack | F1 Podcast Indonesia,"Selamat datang di The Sidetrack! Di sini kita akan ngobrolin seputar topik-topik terhangat, preview & review balapan Formula 1 dari sudut pandang penggemar di Indonesia. Dipandu oleh duo grid terdepan @ardiantowibowo8 & @mayandawidayana."
22EFUSmruDKlYTHIjfUzHu,Podcast Indonesia Ok,Tutorial Podcast
1SaiHhWXIb0HE2J9ybngV1,United Podcast Indonesia,Wadah nyinyir fans Manchester United di Indonesia
0KmP4IYN6eZlBE6DRw6I4H,FPI (Future Podcast Indonesia),Podcast by @breakingfuture_official
4pqK0NVMB0VAOxUfef3nxw,PR INDONESIA PODCAST SERIES,The first and only Indonesia Exclusive Community based magazine in PR #IndonesiaBergerak
1U4vWMTfB3M8zkLY5J6tXi,Rest In Podcast (Indonesia),"Dua laki - laki yang satu kacamataan dan satu lagi juga (Lah). dengerin aja dulu, cuman basa basi 2 orang yang punya background karakter masing - masing. punya pengalaman masing - masing, punya jalan hidupnya masing - masing, tapi jokes-nya satu dan podcastnya satu cuman di Rest In Podcast (Indonesia). - Dogon dan Lukman."
1OKoQvAg8dc9VQzeMw3oem,PODCAST LIVERPOOL INDONESIA,Podcast sepakbola yang membahas seputar Liverpool FC dan berafiliasi dengan fanspage Liverpool Indonesia (facebook) dan @liverpool.li (instagram). Semoga berkenan dan selamat mendengarkan. Royal! Loyal! Total! #YNWA
2OXKU2lWgGjsT6JGOJ4sXV,Slow Short Stories Indonesian (SsstIndonesian),"A podcast where you can listen to a wide variety of stories such as world news, Indonesian language andculture, and much more in simplified Indonesian at a slow pace so you can understand the main ideas and important points of our stories. In our episodes we emphasize all aspect of language learning from listening comprehension, vocab building and retention, exposure to grammar and common idiomatic expressions, to pronunciation practice. You can find transcript of the stories and some useful points for learning Bahasa Indonesia at: https://tinyurl.com/ssstindonesian"
3sLZzKrsDyFj2X2BGZoLaE,Podcast Movement Indonesia,Yuk Gabung di Komunitas kita belajar bareng bikin Podcast.
7KLt9tlejsbv3FwFzrQ1OZ,Demo Indonesia Podcast Hosting,Demo hosting file podcast sekaligus website podcast.
7F8hgTBs83LXIdRoIEWXFV,Tupperware Indonesia Podcast,Tupperware Indonesia Podcast Channel
2ag7bSwXayZLojSJGH6RwN,Podcash Bisnis & Investasi,"Podcash ini bertujuan untuk membangun kewirausahaan & budaya berinvestasi di Indonesia. Seperti yang sudah kita ketaui, Indonesia sangat kekurangan wirausaha & investor. Bahkan, Negara kita termasuk wilayah Investor Warning.     Untuk itulah kami mengajak masyarakat Indonesia untuk berani memulai. Berani memulai bisnis untuk berkolaborasi dengan investor. Berani menciptakan lapangan pekerjaan yang baru. Satu langkah kecil anda, dapat meningkatkan perekonomian Indonesia."
27cdS35B5lNiFblaZZatcg,PODCAST THE RAP UP INDONESIA,Di Podcast The Rap Up Indonesia kita ngobrolin berita dan tren terkini yang relate sama kehidupan kita sehari-hari. Bareng Willy Winarko dan Raben pastinya ngobrolnya fun dan seru.
2NqoKYS2nRxLRGu7AOycbY,Belajar Bahasa Jawa,Podcast ini berisi materi belajar Bahasa Jawa. Semoga bermanfaat.
7JRdDYLYSc93HCOOIzTsQo,KLEECORDER,Podcast pengembangan diri persembahan @klee.id buat bantu kamu menjadi lebih baik! ✨  Untuk kerjasama dan kolaborasi silahkan email ke partnership.klee@gmail.com
7BB8dd57TIo1dsH8Eky4i1,Gelora Indonesia Podcast,"Muwujudkan Indonesia yang berdaulat, adil, makmur dan menjadi bagian dari kepemimpinan dunia"
66JzjLQUSiupd5KxfSJc4k,Podcast Daarul Huffadz Indonesia,Jadi ini adalah channel podcast daarul huffadz indonesia. Selamat mendengarkan. Jangan lupa follow channel kami :)
2RvBB6V8Jdsz7PI3MD0kJl,Audiobook Indonesia,Perpustakaan digital buku audio berbahasa Indonesia.
7sxbcNzmHIkgBAjkkXMebT,Podcast Jogjakarta United Indonesia,Podcast JUI membahas seputar Jogjakarta United Indonesia dan juga ngulik berita tentang Manchester United dengan gaya khas ala-ala anak JUI
2xKRXXbytRBNrX8yBeXWmY,PODCAST WITH FEMME FATALE _ AVAKIN LIFE INDONESIA ,EPISODE 38 LIVE PODCAST WITH FEMME FATALE _ AVAKIN LIFE INDONESIA #avakinlife
63Ur89n0D1dltVu4LdhSlX,self improvment,Welcome! mari berproses bersama dengan podcast sederhana!
7baeimpi2AqzASTofWbR4Z,Proyek Pembangunan,Podcast yg akan membahas semua hal tentang pembangunan dari kehidupan sehari hari hingga proses teknik proyek pembangunan
4naO4ALednAjgrbF0bdXwj,Podcast Kelakar Indonesia,Podcast membahas hal-hal sosial dan politik
1dowl2OFAQ37gjp5MUKxHa,Kurang Terkenal Podcast,"Menceritakan kisah orang kurang terkenal dari berbagai topik. Tayang setiap hari sabtu.  Sebelum dengerin, Follow dan nyalain loncengnya dong kaum ga terkenal!"
4BPWXrKqnxm6iFlfmYpMSp,Evaluasi Podcast,"“Evaluasi Podcast"" adalah tempat di mana kita menggali lebih dalam ke dalam berbagai topik menarik, mulai dari gaya hingga seni, sambil memberikan pandangan kritis dan analisis mendalam. Ditemani oleh para pengisi acara yang akan menemanimu, podcast ini mempertimbangkan berbagai sudut pandang untuk membantu Anda memahami tentang sesuatu. Kirimkan juga ceritamu untuk diangkat di Evaluasi Podcast melalui email evaluasipodcast.id@gmail.com. Selamat Mendengarkan"
7xYj5FttmofQqOM05GknXf,Anxiety teguh setiawan 3,"Lanjutan dari akun 1 dan 2, untuk kemajuan podcast ini anda bisa berdonasi ke link ini https://teer.id/anxiety_teguh"
71zZE4z8QPkltmvf5Jx2AX,Kisah Galau Remaja,"Selamat datang di Podcast KGR atau Kisah Galau Remaja. Menceritakan tentang keresahan, unek-unek, curhatan host Ahmad Lukman akan semua hal yang sedang terjadi di masyarakat maupun keresahan akan pengalaman pribadi. Dan tentunya, ada setiap pembelajaran di setiap cerita yang dilalui.  • Jangan lupa dukung podcastnya, stay tuned, follow ig gue @ahmadlukman dan @kisahgalauremaja, dan jangan lupa buat yang mau donasi https://saweria.co/podcastkgr biar makin berkembang! • Insha Allah akan mulai rutin upload tiap WEEKEND"
4rpRVUAYbyLAsgfG3lWptx,InfoPodcast Naira,"Selamat datang di Naira Studio Podcasting di Spotify! Jelajahi kehangatan dan keceriaan melalui segmen InfoPodcast kami yang menyajikan obrolan santai di sore hari. Temukan pelarian dalam suasana yang penuh keakraban dan inspirasi, di mana setiap episode mengajak Anda untuk mengeksplorasi topik menarik sambil menikmati waktu santai Anda.  Di sini, kami membawa Anda ke dalam percakapan yang menyegarkan, membahas beragam topik mulai dari Entertainment, Edukasi, UMKM & Budaya Melayu. Dengarkan narasi ringan yang dirancang khusus untuk memberikan pengalaman mendalam dalam keseharian Anda."
1OR17VFEgtwDezLoidMyGh,PODCASTIND,Jakarta Keras! tt kali lembek! pokoknya yang seru2 sama yang serem2 ada disini. dengerin yaaa
3P7PDPISEOqb5V5V8WxNis,Curahan Sebelum Molor,"teman tidur buat kamu yang sendiri atau sedang merasa sendiri. tentang hal-hal di sekitar kita, keseharian kita, masalah-masalah kita, dan tentang bagaimana kita menjalani hari. Produced by DRP Studio (Dalam Ruang Produksi)"
3PgOjw5jalkiOooRc35PXX,La Cultura Indonesia Podcast,La Cultura Indonesia Podcast adalah diskusi ringan mengenai kebudayaan modern masyarakat Indonesia di era digital. Obrolan ringan ala mahasiswa tentang keresahan yang mereka dan orang sekitar mereka rasakan.
1S8uirsUcS6vt0wAThGJnE,Smart People Award Podcast,Deskripsi podkes ini ? Mohon sumbangan nya biar kami bisa beli soundcard baru
0W19f7OCK3H5F6cpYaNVu2,Podcast Hero Daily Indonesia,Selamat datang di Podcast nya Hero Daily Indonesia.. Tunggu keseruan-keseruan obrolan kita ya bareng bintang tamu yang menarik pastinya..
4nmujF5y2STSDcqpGpSGoj,Podcast Habis Kerja,Mencoba haha hihi setiap selasa dan kamis
3zDgBINsEZUprH1DzTc1ll,Waktu Indonesia Bagian Podcast,Projek Pelajar Pancasila SMAN 3 Bandung XII IPS 1.  Bhinneka Tunggal Ika sebagai wadah toleransi di masyarakat Indonesia.  Setelah mendengarkan yuk diisi Google Form-nya!  https://docs.google.com/forms/d/e/1FAIpQLSc5vF88MZU70SDomR8SAzF4qxo-9Pg3lzco-ex-_nZzX9-LZQ/viewform
4QMapcexez7tFb6RoU4Unj,PODCASTnya MAYA,"Namanya Sugeng Dalu dan per tanggal 11 Juli 2020 berubah jadi PODCASTnya Maya karena pengen aja 😂 . 100% isinya bermanfaat bagi yang gabut. So, selamat datang ya !. 🤍"
1ZEJnUS0rjS7Fjp4cxggBF,Podcast Masa Sekolah,"Sebuah podcast yang dibuat secara sengaja untuk mengenang kembali masa-masa yang penuh warna di sekolah. Siapapun boleh berbagi cerita kenangan sekolahnya di podcast ini. Cukup kirimkan ceritamu lewat media sosial Podcast Masa Sekolah. Jangan lupa juga untuk mengikuti Podcast Masa Sekolah di Spotify, TikTok, Twitter, Facebook, dan Instagram. Terima kasih banyak untuk dukungan dari teman-teman semuanya!"
0IeDHATqwuRJLh8i6g98UZ,Indonesia Hospitality Podcast,"This podcast is about all things hospitality in Indonesia. Whether you're an experienced hospitality professional, new investor or just curious about the opportunities in Indonesia - you are bound to get something out of this podcast."
4TakBT0rHj5DLt0DvN85NO,Indonesian Fellowship PAC Podcast,A podcast by members of Indonesian Fellowship Pasay Adventist Church. We talk about everything under the sun and put a biblical perspective into it.
0ANykdjULcVqNAeCLBOR6U,Podcast Kita,tentang indahnya menerima hidup
2O4bQIT7RrjYM88k6se7bg,PPI (Podcast Pengangguran Indonesia),"Podcast Pengangguran Indonesia adalah podcast yang akan berbicara apa saja soal keresahan menjadi pengangguran di indonesia. Diisi oleh 2 pengangguran yang resah dan tidak kunjung dapet kerja, sudah saatnya pengangguran bersuara. TETAPLAH HIDUP WALAU TIDAK BERGUNA."
09NN1wgZF1fLzPjEiNeAUr,Demo Indonesia Podcast Hosting,Demo hosting file podcast sekaligus website podcast.
3jfgER6T9eYPpe0dxunICh,Podcast Pendakian,Cerita tentang pengalaman ngedaki kamu !
3E6aSsPxDUIvJBP6PgRvG4,Vodcast Indonesia,"Ngobrol ngalor-ngidul soal dunia Voice Over yang ternyata LUAS BANGET! Available at Noice, Spotify dan Google Podcast"
4O35Eotimv50Rs9C3Ms1uD,Asal Ulas - Podcast Indonesia,"Podcast Indonesia yang mengulas apa saja! Kami akan ulas apapun itu mulai dari film, tempat, tokoh, tips, isu terhangat, dan lainnya.  Jangan lupa, ulasan ini dari sudut pandang kami ya, jangan kaget kalau banyak yang asal. Namanya juga asal ulas :)  Instagram: @asalulas.podcast"
2ootGpGUNEvM4a0pE6w6qp,Indonesia Software Quality Assurance (ISQA),Indonesia Software Quality Assurance (ISQA) is one of vibrant Software Quality Assurance group in Indonesia. We have organized several meetings and workshops ever since we have started in 2016. Enjoy all the recorded meetups about Software Quality Assurance through our podcast.
3oHZdBHW8MrDBjWO8ERfl1,Podcast Penjajahan Bangsa Belanda Di Indonesia,"Disini, saya Richard Juan Euclid akan menjelaslan tentang awal mula kedatangan bangsa Belanda di Indonesia, kemudian kebijakan kebijakan apa yang ditetapkan pada saat penjajahan, serta dampak positif dan negatif dari Penjajahan ini."
63l6xor5QwOxceFJyMvGiE,Podcast Stunting dan Malnutrisi Anak ,"Podcast Stunting dan Malnutrisi Anak (PSM) merupakan Podcast yang membahas mengenai urgensi dari permasalahan stunting dan malnutrisi anak di Indonesia. Podcast ini menjadi wadah untuk belajar lebih dalam mengenai stunting dan malnutrisi. Harapannya, podcast ini dapat menjadi sarana edukasi untuk membantu meningkatkan kesadaran masyarakat dan turut membantu menurunkan angka stunting dan malnutrisi pada anak di Indonesia."
6fJRK2YmEKGnASNN7bgOB6,ESCM Indonesia - Enabling Supply Chain Management,"ESCM Indonesia - Enabling Supply Chain Management is a weekly podcast where your host Efrata Denny, Founder and CEO of ESCM Indonesia, has a one-hour (or so) conversation about a Supply Chain related topic with various guest speakers from the industry during webinars whether it's tips for the best practice, lesson and learn from the industry, or how to learn beyond the supply chain."
00tx1HnnL4ILWq0tSDsqaZ,SwipeRx Indonesia ,Membangun bisnis Farmasi Indonesia
6RXscRJ5dVAIHW1vvcoubZ,Podcast Sejarah Indonesia,Di Podcast ini kami akan membahas berbagai macam sejarah Indonesia hingga konspirasi di baliknya. So keep listen and enjoy our podcast.
0pNhiQbwEYrCWWisX8gYbJ,THINK,"Value Investing Society.  📍Sampoerna Strategic Square, Indonesia  Let's Connect! Website: think.id Instagram: instagram.com/thinksite.id YouTube: youtube.com/Think.id2024"
66RAENCALhWQyVSiNpiRhk,Wahyu Ghofur,"Berisi tentang apapun yang ada di indonesia bahkan dunia, baik dari segi cinta maupun politik dan perjalanan Support this podcast: https://podcasters.spotify.com/pod/show/wahyu-ghofur/support"
1JLVSVUx99SvVjJhmVgLHa,Kata Alterick,Kata Alterick adalah podcast puisi yang dipersembahkan untuk para pecinta puisi di Indonesia. Follow Instagram Kata Alterick di @alterick_
2HxyNVDTUBJaO3bTZ1qVKa,Antropologi Indonesia,"Antropologi berkembang di Indonesia sebagai warisan dari studi tentang subjek kolonial Hindia Belanda. Berawal dari studi Indologie oleh akademisi Eropa (juga akademisi native setelah era politik etis) yang berfokus pada kajian masyarakat adat, antropologi berkembang menjadi sesuatu yang 'baru'. Podcast ini menampilkan rupa Ilmu Antropologi dari pengalaman belajar dan merelevankan diri dalam dunia kerja, baik sebagai teknokrat negara, aktivis, atau bekerja di dunia industri. Dituturkan dengan format percakapan lintas generasi antara mahasiswa dan para alumni."
2XUBWZFN5vyGFL9RTtz6If,Network Education Tools Program,"Audio pembelajaran yang bisa digunakan untuk new distributor Tiens Indonesia, PENTING ! Audio ini hanyalah fasilitas gratis terbatas untuk para distibutor baru & tidak akan di update, untuk mendapatkan update Net.p terbaru silahkan langsung berlangganan ke Stockis Tiens terdekat, agar ilmu dan wawasan anda semakin bertambah dan berubah mengikuti perkembangan zaman saat ini."
4bSkrXP20pPmiF4Mjb2Wuw,Investigasi: Skandal Adopsi,"Ribuan anak diadopsi secara ilegal. Setelah dewasa, mereka menempuh jalan berliku untuk mencari ibu kandungnya. BBC News Indonesia menginvestigasi skandal masa lalu ini."
2RvBB6V8Jdsz7PI3MD0kJl,Audiobook Indonesia,Perpustakaan digital buku audio berbahasa Indonesia.
3cCnOdekDtJ2QgOnGFoU38,The Daily Fix,"Selamat datang di The Daily Fix. Podcast VICE Indonesia ini akan jadi muara gosip-gosip underground, berita terpanas, sampai tips bertahan hidup di industri musik Indonesia. Lo juga bisa rasain liputan event-event musik terbaik Indonesia (kalau kami dapet tiketnya) dan wawancara musisi tokna alias tokoh skena (kalau kami temenan).  Dipandu oleh si sotoy Omar Prazhari alias Si Paling Skena alias Si Paling Jurnalis Musik. Setiap Senin sampai Jumat, hanya di Spotify!"
2ePiC8788MukbeTtTEWhKQ,Memahami Diri,Posdcast ini dibuat untuk kita yang sedang proses memahami diri sebuah bentuk dari menyayangi diri kita sendiri. Kita bisa dapat memulai berinteraksi dengan mendengar apa sih yang diingikan oleh diri kita sendiri?  Dari podcast ini kita bisa sama-sama belajar menjadi manusia yang lebih baik lagi untuk melanjutkan langkah kehidupan kita kedepannya.  Karna orang paling bertanggung jawab atas diri mu ialah diri kamu sendiri. So jangan mulai mencintai orang lain bila kamu belum mencintai diri kamu sendiri.
7baeimpi2AqzASTofWbR4Z,Proyek Pembangunan,Podcast yg akan membahas semua hal tentang pembangunan dari kehidupan sehari hari hingga proses teknik proyek pembangunan
7nO0xgiQ5anVUCL4D8EfKn,Bilik Musik,"Bilikmusik Podcast adalah Medium verbal dari sebuah music/event publisher yang dirintis melalui instagram; @bilikmusik. Melalui podcast ini, segala macam subyektif kami tentang musik akan diejawantahkan secara lantang dan tanpa tendensi apapun. Untuk bisa update seputar event musik dan rilisan terbaru dari musisi indonesia, kamu bisa mengikuti kami di instagram @bilikmusik, twitter @bilik_musik, facebook: Bilik Musik dan web kami di bilikmusic.wordpress.com"
4cNNzJrbh207fi6BQGkxZF,Wana Historia 🌏Sejarah Boomas🐾,"Sejarah Boomas menjadi channel podcast yang akan membantu mengulas dan membahas seputaran dunia sejarah, terutama di wilayah Gresik hingga ke Nasional Indonesia. Akan ada banyak kisah yang tidak pernah kalian ketahui di buku-buku dan pelajaran manapun.  Ikuti update terbaru setiap hari Senin ya. Temui kami juga di YouTube Sejarah Boomas.  Stay tune and enjoy it Support this podcast: https://podcasters.spotify.com/pod/show/sejarah-boomas/support"
0K6y2ytpWKzy3gg1TN69Y1,PODKES (Podcast Kesehatan),Mebahasan wawasan tentang kesehatan individu dan kesehatan masyarakat juga menghidupkan agitasi terhadap sektor kesehatan di Indonesia
5zHEYmPN08hVVVKMKPOZ7K,Bincang Asik,"Disini kita bisa ngomongin apa aja hal-hal asik yang bakal bikin kalian lebih semangat buat ngejalanin hidup dewasa ini dengan Bincang Asik aja. Aku bakal up di setiap minggu nya yaaa, dan kalo mau ngobrol atau curhat sama aku dm aja di ig @ridaulmgh__"
75xoiItq4l2R5dPHRO9a8p,Vocabulary Podcasts Today,Podcast for students. All episodes consists of English Vocabularies that meant to teach Indonesian students to learn English..  Podcast ini berisi kosakata berbahasa Inggris yang diperuntukkan untuk belajar dan menguasai Bahasa Inggris yang lebih banyak lagi.
4x2etZ1ciRI29gvLuI6htL,NgobrolSaik Musik Indonesia,"Podcast yang bakalan ngebahas tentang dunia musik Indonesia yang saik!! Mulai dari review single baru, album baru, kabar terpanash, mungkin juga sedikit bisikan-bisikan yang kita denger dari para pegiat skena~"
4E9QarMR2rBi23jO1AOlPg,"Podcast Ppkn ""Ketertinggalan Pendidikan Di Indonesia""",Di podcast ini menjelaskan bagaimana indonesia mengalami ketertinggalan dan solusi apa yang dapat digunakan
1dowl2OFAQ37gjp5MUKxHa,Kurang Terkenal Podcast,"Menceritakan kisah orang kurang terkenal dari berbagai topik. Tayang setiap hari sabtu.  Sebelum dengerin, Follow dan nyalain loncengnya dong kaum ga terkenal!"
4BPWXrKqnxm6iFlfmYpMSp,Evaluasi Podcast,"“Evaluasi Podcast"" adalah tempat di mana kita menggali lebih dalam ke dalam berbagai topik menarik, mulai dari gaya hingga seni, sambil memberikan pandangan kritis dan analisis mendalam. Ditemani oleh para pengisi acara yang akan menemanimu, podcast ini mempertimbangkan berbagai sudut pandang untuk membantu Anda memahami tentang sesuatu. Kirimkan juga ceritamu untuk diangkat di Evaluasi Podcast melalui email evaluasipodcast.id@gmail.com. Selamat Mendengarkan"
1TDKJ5IVvK5UERhutOveHU,Belajar Podcast,"Agis & Gatra lagi belajar bikin podcast !! sembari kami belajar, semoga ada pelajaran yang bisa kamu ambil dari obrolan kami  Belajar Podcast ?! namanya juga belajar"
0a1c73QiA8oiIA6LwitFJa,PodcastMü,PodcastMü adalah salah satu program unggulan PPI Munich (Perhimpunan Pelajar Indonesia cabang Munich) sejak tahun 2019 dimana moderator dan tamu pembicara akan mengupas hal - hal ringan hingga kompleks dengan tema yang bervariasi. PPI Munich percaya berdiskusi adalah salah satu sarana untuk memberikan ide yang inspiratif bagi masyarakat luas.
4AiQk1vJyD6cDA67a7UT7K,Extreme Moshpit's Podcast,Extreme Moshpit PODCAST: Dig Deep into the realm of LOUD MUSIC in Indonesia
6oNeG5NDSMEI6gA4e1o9ca,PODCAST BNN,PODCAST BNN (Bagian Ngomong Ngomong) merupakan podcast yang banyak ngomongin problematika di kalangan metalhead dan skena metal oleh 3 pemuda :  - Donny : Vokalis Band Skjhønnhet Black Metal Atmospheric - Oni : Vokalis Band RKK Grind Noise - Sinyo : Pemuda Penilai Karya Metal Band-Band Indonesia
29AzLy3jbtCE5xyQWRULxC,Alkitab Siniar,"Siniar (bahasa Inggris: podcast). Kumpulan bacaan Alkitab harian, renungan, cerita alkitab untuk anak, kesaksian satu dalam kasih dan doa bagi bangsa menghadapi COVID19."
4rpRVUAYbyLAsgfG3lWptx,InfoPodcast Naira,"Selamat datang di Naira Studio Podcasting di Spotify! Jelajahi kehangatan dan keceriaan melalui segmen InfoPodcast kami yang menyajikan obrolan santai di sore hari. Temukan pelarian dalam suasana yang penuh keakraban dan inspirasi, di mana setiap episode mengajak Anda untuk mengeksplorasi topik menarik sambil menikmati waktu santai Anda.  Di sini, kami membawa Anda ke dalam percakapan yang menyegarkan, membahas beragam topik mulai dari Entertainment, Edukasi, UMKM & Budaya Melayu. Dengarkan narasi ringan yang dirancang khusus untuk memberikan pengalaman mendalam dalam keseharian Anda."
3MzJbOJWQaCjh0X65eu9z3,Om2 & Generasi Stroberi,Majelis Lucu Indonesia mempersembahkan @patrickeffendy & @adrianoqalbi duo om2 yang gak lucu2 amat tp kekeuh merasa lebih keren dr generasi sekarang! Percakapan mereka tentang dan dengan generasi stroberi yang membahas banyak hal2 yang menarik buat diperdebatkan. Siapa yang lebih keren antara generasi rebel pembangkakng yang hidupnya penuh getir atau generasi stroberi yang selalu keren tapi gak tahan tekanan?
