id,name,description
7vRGphUOaEtbpc1DhPZWDK,Pengembangan Diri,"Welcome! Dalam podcast ini, kamu akan belajar berbagai hal tentang pengembangan diri, kehidupan, & karir. • Podcast ini saya buat untuk generasi muda Indonesia agar bertumbuh setiap harinya, serta untuk anak cucu saya kelak. • Kalau ada pertanyaan / kolaborasi, DM aja ke @selfdevpodcast ya! • Jangan lupa follow & nyalakan lonceng agar tidak ketinggalan episode barunya ya! • ""Never Stop Learning, Because Life Never Stop Teaching!"""
0ndAfvIdPqR9JkInxgTXLe,Ngakak semaunya bareng Stand Up Comedy Indonesia!,Managed by Medio Podcast by KG Media yang menyajikan tayangan komika favoritmu (senin-rabu-jumat) dari Stand Up Comedy Indonesia (SUCI) KompasTV.  Udah siap ketawa ngakak sama komika?  Let's make laugh! :))  Tonton Balada +62 Dwik dan Kukuh hanya di: https://tiptip.co/p/balada62  #WaktunyaSemaunya #NgakakSemaunya #KetawaTerus  MEDIO by KG Media  Playlist podcast by Medio di Spotify: https://link.tree/SiniarMedio Instagram: https://instagram.com/mediobykgmedia  Read about us on: https://kolom.kompas.com/Medio.KGMedia  Kerjasama Kuy! kirim ke podcast@kgmedia.id
0G6mGmKIBBwBfZeAk6QDSc,Belajar Menjadi Dewasa,Sebuah podcast yang mengantar kamu ke dunia pendewasaan. Kamu bisa komunikasi sama aku di belajardewasa65@gmail.com dan instagram @belajarmenjadidewasa_
2czkc27sQGLZd9ErHbUSe8,Podcast Sejarah Indonesia (POSEIDON),Podcast yang bikin kamu gagal move on. Email : podcastsejarah@gmail.com IG : www.instagram.com/podcast_sejarahindonesia/  Powered by Firstory Hosting
4gLJ97Smr64Z7xIa5v65gC,DESTAnya Siapa?,Obrolan Desta seputar pertanyaan-pertanyaan yang sering muncul di lingkungan sekitar. Dengerin biar gak salah jalan!
55PbWJYEtha9TflG1ACWGJ,Podcast Sejarah,Sebuah podcast yang akan menggali berbagai peristiwa dan sosok dari masa lalu. Dari yang kesannya remeh temeh sampai hal krusial yang menentukan hidup kita hari ini.
57SXR6IQvxslXtBC4CjZfQ,Podcast Cerita Lucu Orang-orang Indonesia,"Di sini ada podcast yang berisi tentang cerita pengalaman lucu dari orang-orang di Indonesia. Buat kalian yang punya cerita pengalaman lucu dan pengen seluruh penduduk bumi bisa denger cerita kalian,kalian bisa DM ke Instagram  @ceritalucuorang  Nanti ada nomor WA buat kirim rekaman ceritanya.  Jadikan dunia bergetar dengan tawa dari cerita pengalaman lucu kalian. Support this podcast: https://podcasters.spotify.com/pod/show/ceritalucu/support"
6OkTJT4ZJjPOzLuQUdEs4Y,Timothy Ronald Podcast,Dalam misi mengubah sistem edukasi di Indonesia
1iIFlumWtP4xI1QEzCBcSY,Satu Persen Podcast,"Satu Persen adalah Startup Life-school terbesar di Indonesia. Satu Persen Podcast berhasil meraih Top 10 Podcast di se-Indonesia di Spotify.   Melalui kurikulum Satu Persen, setiap topik terkini akan dibahas bersama founder, mentor, psikolog, dan juga pakar yang expert dalam bidangnya. So, don't miss out and stay tune.   For business inquiries: kiky@satupersen.net"
1Gjoi8gXw7PchKe0fgJJKR,Baca Buku Audiobook Indonesia,"Berawal dari sebuah artikel yang menyatakan betapa rendahnya tingkat membaca di Indonesia. Maka saya membangun channel yang khusus menyajikan audiobook dalam bahasa Indonesia. Tujuan saya adalah agar kita semua mendapatkan kemudahan dalam hal belajar dan meningkatkan pengetahuan.  Ada ratusan buku best seller yang pernah saya baca dan tersedia dalam bentuk audiobook. Anda akan menemukan buku audio dengan berbagai genre yang berbeda. Mulai dari buku-buku tentang filsafat, pengembangan diri, novel, ilmu pengetahuan, spiritualitas, dan lain sebagainya.  Donation link: https://saweria.co/bacabuku Support this podcast: https://podcasters.spotify.com/pod/show/gunt/support"
6KjdNWVqAzKwXv9IgO2SMs,Do You See What I See?,Kumpulan Cerita Horor Indonesia. Kurasi cerita oleh @mizter.popo. Follow & kirim pesan ke Instagram @podcasthoror.id untuk diskusi dan berbagi kisah / pengalaman horor kalian.
3OQC2vxWJwhTmHMfbezF37,CNN Indonesia,Selamat datang di Podcast CNN Indonesia! Di sini kalian akan mendengarkan banyak berita dari tayangan CNN Indonesia dalam bentuk podcast. Follow juga instagram kami di @cnnindonesia dan @cnnindonesiatv untuk update berita terbaru setiap harinya.
19pGwmkVknFOUTPNYpR4wT,Rumah Horor Indonesia (RHI),"Bagi saya cerita horor merupakan hiburan terlepas dari percaya atau tidak percaya, nyata atau hanya karangan saja. Semoga kalian juga bisa menikmati koleksi cerita-cerita di podcast Horor ini sebagai hiburan. Sekalipun hiburan, berani dengerin sendirian?  Kirimkan cerita horor kalian ke deny.ristanto1104@gmail.com  Dengerin podcast RHI di berbagai platform favoritmu https://open.firstory.me/user/rumah-horor-indonesia/platforms   Traktir saya kopi  di  https://trakteer.id/deny%20ristanto  https://saweria.co/denyristanto  https://sociabuzz.com/deninzo/tribe  Powered by Firstory Hosting"
7FevBPboXDSB4K90BJ54pA,Sleepy Stories: To help you sleep,"Hi, there, come and join us every Friday to read you sleepy stories from all around the world. Read in soft tones to help you drift off to sleep or aid you in feeling relaxed and tranquil. We will be reading folktales, fairy tales and all kind of stories from different countries and cultures.So, sit back, close your eyes, relax and enjoy.If you enjoy this podcast, please leave a rating and review on Apple so it can reach more people."
0H9OgzHgHVos0GNwz0wsHs,Lentera Malam (Podcast Horor),"Yo, klik lonceng notofikasinya yo :p || Buat kalian pecinta horor kalaian udah dateng ke podcast yang tepat. Kita akan menyajikan berbagai Cerita Mistis yang bakal di bawain oleh Narasumber langsung atau di bawain sama Host kita, Adhit dan Jamal. Jadi jangan lupa follow podcast ini dan follow juga instagram kita di @lenteramalam.id biar kita bisa lebih deket lagi sama kalian. Dan kalo kalian mau cerita horor yang paling update, bisa mampir ke YouTube Lentera Malam. Support this podcast: https://podcasters.spotify.com/pod/show/lentera-malam8/support"
4gf0RXE6Q3k0AYp1QkRKgh,Musuh Masyarakat (Noice Original),"""Unpopular opinion"", Menghadirkan orbolan dari perspektif yang bersebrangan dari suara mayoritas, mencari sisi baik dari kesalahan/kejahatan, mencari kekurangan dari tiap kebaikan bersama Tretan Muslim dan Coki Pardede ----------------------------------------------------------------- Klik link ini https://go.onelink.me/cyOg/youtube  untuk download aplikasi Noice sekarang. Gratis!  -----------------------------------------------------------------  Dengerin beragam konten audio seru, mulai dari Podcast, Audiobook, dan Radio."
1H0iGB2cfkYoTAEKwMcmHr,PODKESMAS,"Tiap Senin & Kamis! Wajib FOLLOW & NYALAIN Notifikasi-nya juga yaaa . Empat pria dengan banyak perbedaan dalam diri mereka, dari perbedaan waktu lahir, perbedaan pasangan hidup, perbedaan saldo rekening, dan juga perbedaan popularitas. Hanya satu yang sama dari mereka, mereka yakin Podcast ini PASTI LUCU DAN BERGELIMANG TAWA! . for business inquiries please contact : contact@podkesmas.asia"
0pmqbx6VfqWabnFps9RgEW,The Indah G Show,"Brought to you all the way from the Big Durian, join us on The Indah G Show as Indonesian internet personality Indah G explores all things taboo & controversial. From sociocultural commentaries to educational columns, research findings and review articles, we're hitting all of the burning hot-button-topics most relevant to modern Indonesian & Asian youth to uncover uncomfortable truths, challenge the status-quo, and inspire honest, thought-provoking conversations.   Available every Tuesday 6 PM WIB (Western Indonesian Time) For business inquiries, email guna1indah@gmail.com"
5vHokTsTmdlLBs1uPgDGN6,Rintik Sedu,a friend
23bKiXxQhr1xKS9fjHx6Gx,AGAK LAEN!,Ngomongin hal-hal yang agak laen di seputaran hidup kami berempat.   For business inquiries please contact: 0817-2306-695 (Adrian)
73WbebZ0SfLF21E2GKS8ek,Cerita Sejarah Islam,"Belajar dari kisah terbaik sepanjang masa. Kami membawakan cerita sejarah dengan gaya penyampaian terkini dan pengulikan materi dengan lebih dalam lagi. Dalam penyusunan naskah, kami menggunakan buku ""Kisah Para Nabi"" dan ""Tafsir Qur'an"" karya Ibnu Katsir sebagai rujukan utama.  -----  Yuk bantu kami untuk terus memberikan konten terbaik melalui donasi di sini: https://bit.ly/donasicsi  Temukan kami juga di : Youtube: https://www.youtube.com/@CeritaSejarahIslamPodcast Apple Podcast: https://podcasts.apple.com/id/podcast/cerita-sejarah-islam/id1532977407 Instagram: https://www.instagram.com/ceritasejarahislam/ Tiktok: https://www.tiktok.com/@ceritasejarahislam  Email: ceritasejarahislam@gmail.com  Powered by Firstory Hosting"
1zyOm0UDyjwWnE7ZwNykBt,GJLS ,"Sebelum Lanjut Dengerin, FOLLOW Dulu Dong, Nyalain LONCENG Pun Deh! . Podcast Rigen, Rispo dan Hifdzi membicarakan semua hal yang kita sukai dong! . Jikalau ingin ber IKLAN dong pun ah langsung saja hubungi contact@podkesmas.asia"
62eQWA1ramyPtwfMdn2QJE,podcast indonesia,buat podcast viral
1EYmQLqYuhzaBEvGlhtqEZ,MENDOAN,"Mendengarkan Dono dan Tian. Hanya sebuah podcast yang diadakan untuk tempat kami ngobrol, sudah. @donopradana @agustianprtama @podcastmendoan"
3xsUjAMx0QKfXLxAEgHF32,RJL 5,RJL 5 Podcast adalah podcast misteri yang akan memberikan informasi dan cerita dari narasumber terpercaya yang mengalami sendiri kejadian mistis maupun juru kunci cerita. Upload konten setiap Rabu & Jum'at untuk memenuhi asupan horror kamu semua!
5yrdpRPrqiEcjrptBwIUYL,Kita dan Waktu,"Di sini, semua tersimpan abadi via suara. Tentang kisah kita dan waktu yang berperan mendewasakan, kita tumbuh meski tak utuh. | Sebuah karya tulisan oleh @helobagas — selamat mendengarkan :)"
0JXOf1JMa4UVqFCXw2ZCgF,Rapot,"@rezachandika, @ankatama, @radhini_ dan @nastashabigail bukan geng nero, anti cuap sembrono. Obrolan hari-hari standar, sengaja direkam untuk disebar, wkwk. Bukan bermaksud mistis, tapi #BagiRapot setiap hari Kamis."
2uUzEzgKAAmwrbNAspmKjh,Besok Pagi (Podcast Pendakian Horor),Kumpulan Cerita Horor Pendakian Gunung
25Grawr1aHpXqsbSBIR0CY,KH Anwar Zahid (PODCAST),KAJIAN ILMU AGAMA Support this podcast: https://podcasters.spotify.com/pod/show/kh-anwar-zahid6/support
5M3mfPOJQKBILzoYUrxC7Q,Podcast Horror Night Story,Berbagi Kisah Seram Untuk Kalian.   PODCAST HORROR NIGHT STORY Twitter : https://twitter.com/chow_mas Instagram: https://www.instagram.com/podcast_nighstory/  Selamat Malam Semuanya. Saya Chow Sing Sing Host dari Podcast Horror Night Story. Podcast Seram yang akan tayang setiap malam. Kirim cerita atau pengalaman seram kamu untuk didengarkan di Podcast ini melalui Email komunitasarwah@gmail.com atau bisa juga DM di instagram @podcast_nighstory. Dan jangan lupa Follow Twitter saya @chow_mas. Selamat Mendengarkan.   Support this podcast: firstory.me  Powered by Firstory Hosting
6srNn7W2aEAI8DZCDGCKEE,Podcast Awal Minggu,"Merupakan podcast dari Adriano Qalbi, dengan durasi kurang lebih 1 jam, yang akan diluncurkan pada awal minggu sesuai dengan namanya. Jika ingin bertanya dan lain-lainya kirim ke podcastawalminggu@gmail.com"
6EmSBAixLaU1CwSu6gyujz,Podcast Raditya Dika,"Podcast milik Raditya Dika dengan tema obrolan tentang keuangan, keluarga, industri kreatif, dan hal-hal di antaranya. Episode baru seminggu sekali."
7prgp80n4pd49sZ3j9per6,Teman Tidur,@podcast.temantidur dengan segudang cerita yang mengantarkan kamu ke dunia mimpi. Oleh @derafirmansyah | www.temantidur.id
1edWM5ohQiAuWqGp622A0D,Podcast Malam Kliwon,Podcast bergenre fun-horror yang digawangi oleh Bimoky dan Dhanu. Membawa anda masuk ke dalam theater of mind dan pengalaman baru dalam mendengarkan cerita horor. Bergidik dan menggelitik. Hii.
7GbuJMHrlrs33f797W1ns9,Impact Community Indonesia Podcast,Impact Community Indonesia Podcast berisi kumpulan khotbah-khotbah Ps. Henny Kristianus dan Ps. Yoanes Kristianus di Impact Community Indonesia.  Selamat mendengarkan dan bertumbuh bersama.  Tuhan Yesus memberkati.
5Y4JTcUmxTcHYaYiqxsKtz,PODCAST ANCUR ,"Mengudara tiap Senin, Rabu, dan Jum’at | Podcast dengan konsep “tongkrongan” yang seru dan harusnya lucu banget. Harusnya ya. InsyaAllah aja dehh. Dan juga kadang podcast ini berisikan curhatan-curhatan hati netizen dan hostnya (colongan). Tapi apakah kami akan memberikan solusi?? Tentu tidak ❤️#PodcastAncur #ANdaCURhat | Instagram: @podcastancur | CP : +62 812 84015289 |"
3sdRGJPHkxlMv7JdfbwlOA,Podcast Balbalan,"Ngomongno balbalan teko kabeh penjuru, mulai liga Indonesia sampek dunia. Diomongno bareng cak ho Support this podcast: https://podcasters.spotify.com/pod/show/podcast-balbalan/support"
3B5gGhRJEHnIeeDUt5jud4,Gema Membiru ,"Mungkin kita akan bertemu dengan banyak gema yang bersahutan dengan isi kepala. Juga, cerita-cerita yang membiru dimakan waktu.  Business inquiries: gema.membiru@gmail.com"
6himx89vE1Y42vwtHBR9ly,Murottal Qur'an Terjemahan Audio Indonesia,"بِسْمِ اللَّهِ الرَّحْمَنِ الرَّحِيم Bismillahirrahmanirrahim (Dengan menyebut Nama Allah, Yang Maha Pengasih, lagi Maha Penyayang)"
68zYvH3xzkEChAROSiAH18,VOA This Morning Podcast - Voice of America | Bahasa Indonesia,"VOA This Morning menghadirkan serangkaian berita dan peristiwa terkini dari berbagai belahan dunia. Bersama tim VOA, VOA This Morning hadir setiap Senin hingga Jumat, dengan informasi yang akurat dan terpercaya, yang mendekatkan pada dunia."
0Cevwz2ekakJUPlm0lNzFm,Wayang Indonesia,Wayang Indonesia adalah warisan dunia.  Support this podcast: https://podcasters.spotify.com/pod/show/Wayangbudaya/support
21E0sms1VBNVb7irBwgMzW,Podcast Dakwah Sunnah,"Ikuti kajian, dakwah, dan ajaran Islam yang sesuai dengan Alquran, Nabi Muhammad Sallallahu Alayhi Wasallam, serta diikuti oleh Tabi’in dan Tabi’ut atabi’in. Dapatkan wawasan keislaman yang mendalam dari para Ustadz bermanhaj Salaf di Indonesia. Kumpulan tersebut dapat diakses dan didownload melalui website: www.podcastdakwahsunnah.com. Jangan lewatkan kesempatan untuk memperkaya pengetahuan agama Islam. Semoga bermanfaat bagi kita semua. Aamiin."
2RXY5kEKWQobky1Y2dSUyF,Podcast Seminggu,Awwe & Pican. Sangat menginspirasi.  For business inquiries please contact: contact@podkesmas.asia
6tJGsARTV6rDTrdMzytxm3,Riri Cerita Anak Interaktif,"Riri Cerita Anak Interaktif berkomitmen menghadirkan serial podcast untuk anak-anak dengan sentuhan pendidikan karakter, moral, dan akulturasi budaya. Mengangkat berbagai dongeng, cerita rakyat, fabel dan cerita orisinal dari seluruh penjuru nusantara dan dunia. Riri ingin meningkatkan literasi dengan cara yang modern dan juga tetap menyajikan hiburan yang menyenangkan, sehingga tetap sesuai dengan jamannya.  Riri - Educa Studio : Menggabungkan edukasi dan teknologi melalui media digital dan inovasi.  PT. Educa Sisfomedia Indonesia Jl. Gilingrejo No. 10 Gendongan, Kota Salatiga, Jawa Tengah"
5nVcnFoVfFz1zAk37xFY2A,Kabi Kisah Teladan Nabi,"Assalamu'alaikum Wr. Wb.  Kabi Kisah Teladan Nabi berkomitmen menghadirkan konten pendidikan islami untuk anak-anak. Melalui channel ini, Kabi hadir dalam format audio kisah teladan Nabi yang berasal dari Al-Quran, fabel, fiqih, sunnah, keluarga dan sahabat Nabi, sampai kisah-kisah inspiratif yang penuh makna.  Kabi - Educa Studio : Menggabungkan edukasi dan teknologi melalui media digital dan inovasi.  PT. Educa Sisfomedia Indonesia Jl. Gilingrejo No. 10 Gendongan, Kota Salatiga, Jawa Tengah"
26q8ZtOr7Zuzx3j9VtuuCi,Podcast Harga Mati,Podcast dari Timur Indonesia bersama Arie Abdur dan Mamatpemabuk
5tHfkp8qnF2B1GtzJSSV9e,LENYAP,"Podcast LENYAP, “Kisah Nyata Kriminal Indonesia”, mengungkap kisah nyata tindak kriminal orang-orang biasa yang ada di sekitar Anda. Dituturkan dengan gaya santai di awal dan semakin mencekam hingga akhir cerita. Sebuah sensasi dramatis yang membuat Anda merasa berada di tempat kejadian bersama si pembunuh yang mengintai di kegelapan. Dengan investigasi mendalam dan pendekatan psikologis, Marissa Jeffryna, seorang pengacara dan pemerhati hukum akan mengupas perjalanan hidup sang pembunuh. Podcast LENYAP, original dari Spotify dan Fremantle Indonesia. Follow Podcast LENYAP di Instagram @podcastlenyap dan Twitter @podcastlenyap."
3L96goGK5uByVjGfXiGqmH,Pita Kuning Podcast,"Podcast oleh Yayasan Pita Kuning Anak Indonesia yang akan membahas tentang dunia pekerjaan sosial, kerelawanan dan komunitas, hal-hal medis yg berkaitan dengan kanker pada anak, dan juga obrolan seru bareng narasumber terpilih. Untuk info selengkapnya cek Instagram kami di @pita_kuning."
71jARxgs0KxOwArI0K4C7T,Close The Door,"Podcast ini merupakan konten di Channel Youtube ""Deddy Corbuzier"" yang membahas tentang kondisi terkini di Indonesia, berita terbaru, kisah inspiratif, dan sisi lain para narasumber yang belum banyak diketahui masyarakat."
3PAN1fcKdno7idSNEECN7D,Guruji Gede Prama Podcast,"The Author in Brief  Gede Prama is a long student of peace. He began his childhood by communing with a symbolical Guru in one of the old villages in north Bali. Later on when he learned from the life stories of many maha siddha (the enlightened), he began to understand his spiritual experience in childhood. This later experience was then enriched by meditating, reading, researching and personal meeting some of world wide spiritual Gurus like HH Dalai Lama, Thich Nhat Hanh and Karen Armstrong.  A scholarship then enabled Gede Prama to continue his post graduate study in England and France. Hard work meant Gede Prama was appointed as CEO (chief executive officer) of a large corporation at the age of 38. And one year later he left behind all the luxuries of the corporate world to begin a journey of serving. To serve people on the path of peace.  Author (  Indonesian) Gede Prama adalah pelayan di jalan kedamaian. Beliau memulai masa kecilnya dengan belajar dari Guru simbolik di salah satu desa tua di Bali utara. Di kemudian hari, setelah belajar dari kisah hidup banyak maha siddha di Tantra (mahluk suci yang tercerahkan), Gede Prama mulai memahami pengalaman spiritual saat masa kanak-kanak. Pengalaman ini kemudian diperkaya dengan bermeditasi, membaca, meneliti dan pertemuan pribadi dengan beberapa Guru spiritual dunia seperti YM Dalai Lama, YA Thich Nhat Hanh dan profesor Karen Armstrong.  Kendati beasiswa pernah menghantarkan Gede Prama untuk melanjutkan studi pasca sarjana di universitas Lancaster Inggris serta mengikuti kursus manajemen puncak di INSEAD Perancis, kerja keras pernah menghantarkan Gede Prama sebagai orang nomer satu alias CEO (chief executive officer) di perusahaan besar pada usia 38, terbang ke sana ke mari termasuk ke luar negeri untuk kepentingan mengajar, namun satu tahun kemudian ia tinggalkan semua kemewahan kehidupan duniawi untuk memulai perjalanan pelayanan. Untuk melayani orang-orang di jalan kedamaian.  Beberapa tahun tahun terakhir, beliau bahkan tidak pernah meninggalkan Bali, menghabiskan ratusan hari dalam setahun di tengah keheningan hutan. Dan hanya sekali-sekali saja keluar dari keheningan hutan untuk berbagi cahaya di tempat-tempat suci di Bali."
72q1XjiuFViF2tx7IbQ5X5,Endgame with Gita Wirjawan,"Join entrepreneur, educator, and proud Indonesian, Gita Wirjawan in exploring the ways forward for our society through stories and experiences by thought leaders, trailblazers, and opinion-makers from Indonesia and the region."
6c1EK0X5GCij5UhfScy4G4,Indonesia True Crime,"BERDASARKAN KASUS NYATA – Di balik headline kriminal, ada cerita lebih. Bersama BP (Rizky Bayuputra) dan Sashi (Sashi Kirana), kita bakal cerita-cerita dan ngebahas kasus kejahatan dari berbagai kota di Indonesia, yang terjadi di sekitar kita.  Podcast ini diproduksi oleh In-depth Creative. | Kunjungi www.indepthcreative.com dan berikan saran, komentar, atau sapa kami di: Email: info@indepthcreative.com | Twitter: @IndepthCreates | Instagram: @indepthcreates |"
3bgcBTdg3Eihhee1hgYDGg,Finansialku Talk Podcast (Indonesia),"Mau tau gimana caranya mengatur, merencanakan keuangan? Investasi? Atau topik keuangan lainnya?   Dengerin aja Finansialku Talk Podcast bersama Melvin Mumpuni, Founder dan CEO dari Finansialku.com   Follow us on Instagram! @Finansialku_com   personal finance. protection. investment for millennial"
0stRlKGDBCMWrC6QISexej,Daily Quote Indonesia,Yuk kita buka harimu dengan quote inspiratif dari berbagai sosok yang menarik sambil kita maknai arti dibalik setiap perkataannnya. Daily Quote Indonesia siap menemanimu setiap hari.Daily Quote Indonesia merupakan sebuah podcast original Spotify Studios dan Parcast. Diproduksi oleh Box2Box Media Network dan dibawakan oleh Suci Patia. Dengarkan episode hari ini untuk menjadi pembuka semangat kamu setiap hari.
2it8tdWQt1u07Rdi1QFVxZ,SEJARAH SERU,"Pada podcast SEJARAH SERU, kalian akan menikmati banyak topik yang spesifik membahas tentang Sejarah Indonesia dan Dunia, yang tentunya dikemas secara SERU dan MENYENANGKAN❗️❗️❗️  Tonton di YOUTUBE : https://bit.ly/YoutubeSeruBelajar Dengarkan di SPOTIFY : https://bit.ly/SpotifySeruBelajar Instagram : https://bit.ly/InstagramSeruBelajar Website : https://bit.ly/WorldwideProduction Linktree : https://linktr.ee/serubelajar.id Contact : +62 896 3017 7462 (Indah)  Powered by Firstory Hosting"
0kxcM1xZDzLEFyuYTy2YB8,Suara Buku Audiobook Indonesia,"Suara Buku adalah kanal yang memuat audiobook bahasa Indonesia. Kanal ini dibuat diperuntukkan bagi siapa saja yang tidak memiliki waktu membaca. Dengan audio book ini, semoga bisa membantu teman-teman untuk bisa membaca buku dengan mendengarkan buku yang sudah diaudiokan oleh Suara Buku.   Instagram : suarabuku.net WA Channel : https://whatsapp.com/channel/0029VaNbFLy3rZZazxbN0E30 Youtube : Suara Buku    Powered by Firstory Hosting"
3quANJScW18IUbWMsQxtAU,MDRT Indonesia Podcast,"Dalam Million Dollar Round Table (MDRT), kita percaya the more you give, the more you get. Sebuah culture saling berbagi dari apa yang sudah kita dapatkan selama ini dari sekolah pelajaran hidup. Para financial advisors terbaik dan bergelar MDRT akan mengisi setiap episode dengan berbagai topik dari practice management, business sales ideas bahkan motivasi dan life financial tips. - Hosted by @johanfanggara, @kennedysumarlie dan teman2 komite MDRT Indonesia, bi-weekly podcast ini juga adalah bagian dari media program @mdrtindonesia. Let's stay in touch dan mari saling belajar."
6FGHyhT9M7vfhTlLfv2IFt,Gesah One Piece || Indonesia,Selamat datang di kapal kami dan selamat menikmati perjalanan menuju One Piece bersama kami.  Jangan lupa Follow Social Media kami Instagram https://www.instagram.com/gesahonepiece/ Threads https://www.threads.net/@gesahonepiece Youtube https://www.youtube.com/@gesahonepiece Twitch https://www.twitch.tv/gesahonepiece  Support podcast kami: https://www.jalintraksi.com/gesahonepiece https://trakteer.id/gesahonepiece/link  Powered by Firstory Hosting
0vFfPAk7zgDLnv3utpZ8ww,Thirty Days Of Lunch Podcast,"Teman makan sekaligus nutrisi untuk pikiran. Podcast ini diinisiasi oleh @fellexandro dan @sheggario yang hidupnya improve from one lunch to another. Sudah 50+ pembelajaran baru dari rockstar yang menginspirasi seperti Mbak Najwa sampai Gary Vee. Dari CEO HaloDoc sampai CEO Bukalapak. Here you go, thirty days of learning on productivity, career, business, and self-development. Thanks to continuous support from you, our friends, and partners, we're now on our third season.  __ Holla at us : hello@thirtydaysoflunch.com __"
5Qvz2kZDcYvJN9AY4awk7N,Nessie Judge,Podcast ini mengulas berbagai macam hal yang erat kaitannya dengan dunia mistis. Aku akan membacakan cerita dari teman-teman yang akan membuat bulu kuduk berdiri dengan cerita horror dan misterinya.
3X3C4FSk2q7eKTX5xjGSjT,Ada Hantu di Sekolah,"Setiap sekolah punya cerita. Setiap sekolah punya rahasia. Di Podcast Ada Hantu di Sekolah, kita akan mengungkap semuanya. Dari teror di ruang UKS sampai arwah penunggu toilet. Dari yang cuma bikin merinding, sampai yang mengancam nyawa siswa.  Ada Hantu di Sekolah adalah Podcast Original dari Spotify persembahan Kukila Network. Dengarkan episode barunya setiap malam Jumat dan malam Senin."
0B1SdJk0Yd2ao4H0Wvz4tn,Senja Bersuara,"Podcast Senja Bersuara adalah tempat kita saling bertukar pikiran dan berbagi rasa. Topik utama yang akan aku bahas adalah seputar self love, overthinking, adulting, dan bahasan lain seputar self improvement dan personal growth. Nantikan episode baru tiap hari Rabu dan Minggu. Semoga podcast Senja Bersuara bisa menemani kamu dan membantu menguraikan benang kusut di kepalamu. Selamat mendengarkan!  Ig: @ssenjarindiani Tiktok: @shcerrr Youtube: Senja Rindiani Business inquiries: sherlysenja.official@gmail.com"
0SyqsUX0Cc6UqmOh63harj,Podcast Bebas Aktif,Podcast diplomasi dan hubungan internasional terbaik se-Indonesia. Tayang reguler 2x seminggu. Temui kami di Instagram/Twitter @kontekstualcom.
1PGN4ilb4aoWKkB7FNSLsx,The Friday Podcast,A weekly podcast with well known subjects every week talking about what's behind the facts. Hosted by Iyas Lawrence.
1qciHS2r5Mjop0XZYrO6iv,Podcast Santuy Indonesia,"3 komika yang berasal dari Papua, Petamburan, dan Anak Polisi yang sok-sokan membahas politik padahal ga ngerti, mengkritik tanpa solusi, dan sok berani padahal gaada backingan. Podcast yang bertujuan untuk mempersatukan rakyat Indonesia agar tidak terpecah belah oleh politik"
1ovfQ4urOIOMHY48ePfpw2,Dongeng Tidur 🌒,"Halo, aku Irene Evita. Podcast ini buat kamu yang susah tidur. Dibuat karena temanku bilang suaraku itu bisa menidurkan.. Diawali dengan obrolan ringan dan diakhiri dengan dongeng. Selamat mendengarkan podcast Dongeng Tidur 🌒 Semoga lekas tidur dan bermimpi indah :) Upload tiap Senin. Find me on⤵️ IG: @irenevitae Tiktok: @irenevitae Utube: Sweet Spring Rene For business➡️ Contact Person: Naya +6281315015034 Hosted on Acast. See acast.com/privacy for more information."
